{
  "key": "2026-09-24-pm",
  "session": "pm",
  "headline": "美債殖利率破5.1%，台股節前小跌133點守住48K，台積電轉弱",
  "summary": [
    "本期資料檔在 13:10 抓取，當時台股還沒收盤，所以台股欄位全部停在 9/23。今日收盤數字引自盤後網頁行情（Yahoo 股市），僅供參考，請以證交所公告為準：加權指數約收 48,024.60 點（-0.28%），盤中最低 47,754.72 點，成交約 7,366.23 億元。",
    "昨天列的風險今天成真：美債 10 年期殖利率升到 5.11%，創 2007 年來新高。道瓊跌 1.03%，羅素 2000 跌 1.28%、貼近 52 週低點；只有費半逆勢漲 0.81%。",
    "台股開低後，跌幅從 400 點收斂到 133 點，最後守住 48,000 點。不過領跌的是台積電，網頁行情約收 2,475 元（-1.00%），聯發科則逆勢收 5,285 元（+1.93%）；資金從權值股移到載板、CCL 與散熱族群。",
    "明天起台股連休 9/25–9/28，9/29 才開盤，期間美股還有三個交易夜，另有川習會與 PCE。今日三大法人與漲跌家數資料不在本期資料檔中。"
  ],
  "sentiment": {
    "us": "中性偏空",
    "tw": "中性"
  },
  "sections": [
    {
      "title": "台股收盤：守住 48K，但換成台積電拖累",
      "body_md": "*先說明資料狀況：本期 data json 在 13:10 抓取，台股段落（指數、法人、類股、漲跌家數）全部還是 9/23 的數字。以下今日收盤數字引自盤後網頁行情與中央社盤中報導，不是本報的正式資料源。*\n\n加權指數開 48,075.39 點，盤中最低 **47,754.72 點**，跌點一度超過 400 點；收盤約 **48,024.60 點（-132.69 點，-0.28%）**，勉強守在 48,000 點之上。成交約 **7,366.23 億元**，比 9/23 的 8,330.28 億元少約 11.57%。**節前量縮、跌幅收斂，比較像觀望，不像出貨。**\n\n但今天的 K 線結構和昨天相反：昨天是台積電撐盤、個股多數在跌；今天變成**台積電約收 2,475 元（-1.00%）領跌，聯發科收 5,285 元（+1.93%）、盤中最高 5,360 元逆勢走強**。指數站在月線（46,554.93 點）之上約 3.16%，短線趨勢沒有被破壞，只是漲勢暫停。"
    },
    {
      "title": "資金流向：節前挑股，錢移到載板與散熱",
      "body_md": "**今日三大法人買賣超、外資個股進出都還沒有資料**（證交所約 15:00 後公布），以下只能從盤面推論。\n\n中央社盤中報導點出幾個族群：\n- **載板、CCL 續強**：景碩盤中漲近 8%，聯茂漲停，騰輝-KY 漲逾 9%，欣興、南電續強。景碩 9/23 成交 268.99 億元、只小跌 0.33%，昨天的換手今天看起來有效。\n- **散熱族群回神**：健策、奇鋐、雙鴻大漲。昨天高力重挫、健策漲停，我們說資金開始在族群裡挑股，今天散熱股整體轉強，昨天的高力比較像個別股票的獲利了結。\n- **晶圓代工偏弱**：聯電盤中跌逾 4%。台積電明年起喊漲晶圓代工價 3–6% 的新聞沒有帶動股價。\n\n回顧 9/23：外資買超 373.13 億元（新聞稱連 5 買）、投信賣超 47.59 億元。今天 USD/TWD 升至 31.83（台幣貶 0.47%），外資的第六天買盤能不能延續，要看 15:00 後公布的數字。"
    },
    {
      "title": "昨夜美股與今晚觀察：殖利率才是主角",
      "body_md": "9/23 美股全面收黑：**S&P 500 -0.76%、那指 -0.69%**（連續創高結束）、**道瓊 -1.03%**、**羅素 2000 -1.28%**，羅素已經跌到 52 週區間 2.2 分位。導火線是 **10 年期殖利率從 4.96% 升到 5.11%**，RSI 76.4，是 2007 年以來新高。\n\n類股很清楚：利率敏感的**公用事業 -2.24%、不動產 -1.76%**雙雙創 52 週新低，通訊 -1.91%（Alphabet -3.80%），非必需消費 -1.41%（Airbnb 爆量重挫 10.35%）。**費半卻逆勢 +0.81%**，KLAC +2.11%、ASML +1.95%，半導體設備撐住半導體。但輝達 -1.47%、台積電 ADR -1.20%，連兩檔龍頭都跑輸費半。\n\n今晚盤前 **S&P 期貨 -0.22%、Nasdaq 期貨 -0.20%**，VIX 15.18，仍在低檔。以今天台積電網頁收盤約 2,475 元計算，ADR 溢價約 **14.86%**，比資料檔用 2,500 元算出的 13.71% 還大。"
    },
    {
      "title": "連假前的盤點：台股休四天，美股有三個交易夜",
      "body_md": "台股 **9/25（中秋）、9/28（教師節）休市，9/29（二）才開盤**；這段期間美股有 9/24、9/25、9/28 三個交易夜。\n\n幾個會在 9/29 一次反映的變數：\n- **殖利率會不會繼續往上**：5% 被突破後，下一個問題是高本益比的 AI 股會不會補跌。目前費半還撐得住，輝達已經先弱。\n- **川習會**（新聞稱今日登場）：結果會直接影響半導體出口管制與關稅的預期，對台股是雙向風險。\n- **中東**：中央社提到伊朗總統的強硬表態也是今天早盤的賣壓來源；WTI 91.50 美元，月漲 11.10%。\n\n**我們的看法**：48,000 點守住、量縮，台股本身的結構沒壞；但連假期間的主要變數都在美國利率，偏向防守，觀點從中性偏多下修為中性。"
    }
  ],
  "watchlist_notes": {
    "2330": "網頁行情約收 2,475 元（-1.00%），盤中最低 2,470 元，沒有再挑戰 52 週高點 2,510 元；漲價新聞沒有帶動股價。ADR 溢價擴大到約 14.86%，是連假後的支撐因素；月線 2,429.25 元是第一道防線。",
    "2317": "網頁行情約收 250.5 元（約 -2.1%），把 9/23 漲的 1.19% 全部吐回，跌到月線 251.35 元下方。9/23 外資、投信同步買超；董事會通過發行不超過 600 億元無擔保公司債。要先看能不能站回月線。",
    "2454": "網頁行情收 5,285 元（+1.93%），盤中最高 5,360 元，以收盤價計算創新高。前一晚 Alphabet 跌 3.80%，它還能逆勢走強，外資喊 7,300 元目標價的報告有助攻。RSI 已在 74 以上，9/22 盤中 5,480 元是上方壓力。",
    "0050": "網頁行情約收 112.40 元，幾乎平盤，高點 112.45 元沒過；台積電跌、聯發科漲，兩者互相抵消。外資近期持續調節 0050，改買主動式 ETF，這個資金流向值得持續追蹤。",
    "NVDA": "收 225.51 美元（-1.47%），量能只有 0.68 倍；費半漲 0.81% 時它卻收黑，連續幾天落後半導體族群。月線 221.15 美元是短線支撐，跌破就代表 AI 龍頭在高殖利率下被調節。",
    "TSM": "收 446.57 美元（-1.20%），跑輸費半約 2 個百分點；以台積電網頁收盤約 2,475 元換算，溢價約 14.86%。晶圓代工漲價新聞是中長期利多，但連假期間 ADR 的方向更受利率牽動。",
    "AAPL": "收 337.02 美元（-0.80%），量能 0.73 倍，離 52 週高點 340.08 美元約 0.91%，還沒突破。台積電漲價可能墊高明年 iPhone 成本，但今晚更直接的變數是殖利率。",
    "MSFT": "收 500.59 美元（+0.52%），是四檔美股自選中唯一收紅；股價貼著月線 499.41 美元與 500 美元整數關卡。新聞提到 9/24 有事件值得關注，內容尚未確認，今晚留意消息。"
  },
  "picks": [
    {
      "symbol": "3189",
      "market": "tw",
      "name": "景碩",
      "type": "強勢股",
      "reason": "9/23 漲停後隔天只小跌 0.33%，成交 268.99 億元，換手平和；今天大盤跌逾 400 點時，它盤中還漲近 8%，新聞稱營收亮眼、奪下成交王。載板與 CCL（聯茂漲停）是今天節前少數有資金進駐的族群。",
      "watch_for": "今天收盤與法人資料 15:00 後才確認。載板題材的源頭是美股 ASIC 與 CPU 需求；連假期間若 AMD、博通回檔（博通 9/23 已跌 2.62%），9/29 開盤的波動會很大。"
    },
    {
      "symbol": "2408",
      "market": "tw",
      "name": "南亞科",
      "type": "事件驅動",
      "reason": "9/23 收 515 元（+3.62%），成交 325.14 億元，外資買超 29,196 張，是這波記憶體題材在台股的代表。不過 IBD 報導 Michael Burry 放空美光、預期晶片進入下行循環；今天中央社形容南亞科、華邦電是震盪走勢。",
      "watch_for": "連假期間美光與 SanDisk 的走勢，特別是空方論點會不會發酵。回到台股後先看 500 元整數關卡，以及外資是否延續買超。"
    },
    {
      "symbol": "GOOGL",
      "market": "us",
      "name": "Alphabet",
      "type": "轉弱警示",
      "reason": "9/23 跌 3.80% 至 337.83 美元，量能 1.32 倍，跌破月線、位在 52 週區間 27.8 分位；中央社把它列為今天台股開低的原因之一。它是 TPU 的主要客戶，聯發科的 TPU 題材也和它綁在一起。",
      "watch_for": "如果它繼續走弱、聯發科還能維持強勢，代表市場在區分個別公司；兩者若一起轉弱，就要小心 ASIC 題材整體降溫。先看 52 週低點 317.69 美元附近的支撐。"
    },
    {
      "symbol": "PLTR",
      "market": "us",
      "name": "Palantir",
      "type": "強勢股",
      "reason": "大盤普跌下它漲 3.68% 至 191.79 美元，創 52 週新高，量能 1.26 倍，是 50 檔大型股掃描中漲幅第一；IBD 點名出現買進訊號。高殖利率環境下，它是少數仍被資金追捧的高評價股。",
      "watch_for": "新聞提到 Burry 同時放空它和美光。站上月線 8.07% 已經偏離，若殖利率續升，高評價股回檔會很快；觀察能否守住 9/23 的突破價位。"
    },
    {
      "symbol": "ABNB",
      "market": "us",
      "name": "Airbnb",
      "type": "轉弱警示",
      "reason": "單日重挫 10.35% 至 149.58 美元，量能 2.79 倍，是掃描中跌幅最大、量能放大最多的一檔，偏離月線 -14.66%。非必需消費類股 -1.41%、在 52 週區間只有 14.2 分位，消費降溫的線索值得留意。資料檔沒有附下跌原因。",
      "watch_for": "爆量長黑後能不能止跌；若旅遊與消費股接著走弱，就和 9/25 的 PCE、消費者信心數據形成同一條「消費疲勞」線。"
    }
  ],
  "events": [
    {
      "time": "今日",
      "title": "川習會登場",
      "note": "新聞稱今日舉行，確切時間以官方為準；關稅、半導體出口管制的相關表述會影響台股 9/29 開盤"
    },
    {
      "time": "15:00 後",
      "title": "證交所公布今日三大法人買賣超",
      "note": "觀察外資能否連 6 買，以及期貨空單有沒有在節前加碼避險"
    },
    {
      "time": "20:30",
      "title": "美國每週初領失業救濟金",
      "note": "殖利率已經到 5.11%，勞動數據若偏強，會強化再升息預期；同時段可能還有其他數據，以官方行事曆為準"
    },
    {
      "time": "21:30",
      "title": "美股開盤",
      "note": "S&P 期貨 -0.22%、Nasdaq 期貨 -0.20%；看費半能否繼續抵抗殖利率壓力"
    },
    {
      "time": "09/25 20:30",
      "title": "美國 8 月 PCE 物價（依慣例於月底週五公布）",
      "note": "Fed 最重視的通膨指標；9/25 22:00 另有密大消費者信心終值（初值 47.8）"
    },
    {
      "time": "09/29 09:00",
      "title": "台股連假後開盤",
      "note": "一次反映美股 9/24、9/25、9/28 三個交易夜"
    }
  ],
  "risks": [
    "殖利率已經從 4.96% 升到 5.11%，RSI 76.4。若 PCE 或勞動數據偏熱、10 年期殖利率繼續升向 5.25%，本益比最高的 AI 股（輝達、Palantir、聯發科）評價壓力最大。今天台股的 RSI 65.6、站上月線 3% 以上，漲多後回吐的空間也比較大。",
    "台股休市四天，美股有三個交易夜。台積電 ADR 溢價約 14.86% 是緩衝，但如果 ADR 在連假期間跌超過 5%，溢價的保護作用就會明顯縮小。另外，今天台幣貶到 31.83，若匯率繼續走弱，外資連買可能中斷。",
    "川習會可能出現關稅或出口管制的新表述，加上中東情勢（伊朗強硬表態、WTI 91.50 美元），兩者都屬於休市期間無法即時反應的跳空風險。",
    "台股今日收盤、法人與漲跌家數都不在本期資料檔中，本報的台股收盤數字來自網頁行情，可能和證交所正式公告有些微差異，請以官方數字為準。"
  ]
}
