{
  "key": "2026-10-14-pm",
  "session": "pm",
  "headline": "塑化漲停潮撐台股彈284點，台積電平盤等法說；美CPI偏熱壓期貨",
  "summary": [
    "加權指數漲 284.52 點（+0.59%），收 48,625.83 點，漲家 741、跌家 240，有 26 檔漲停，上漲的股票很多。但**成交金額從 1.06 兆元縮到約 9,193 億元**，台積電平盤、聯發科收黑，半導體類股持平，媒體形容「只演半場」，盤中站上 49,000 點後又跌回來。這次是傳產帶動的量縮反彈，權值電子股沒有跟上",
    "**塑膠類股大漲 9.27%**，台塑四寶公布第三季自結獲利後，台化、南亞強攻（南亞成交 602 億元，金額僅次於台積電）。外資賣超縮小到 200.37 億元，媒體統計已連六賣；買超前幾名是中鋼、台塑、台玻、華新，賣超集中在南亞科、京元電子、聯電，**外資從半導體轉向原物料的方向沒有改變**",
    "美國 9 月 CPI 年增 3.7%，高於預期的 3.6%，核心 CPI 2.6% 也比預期高 0.1 個百分點。10 年債殖利率升到 5.31%，是 52 週新高，美元指數也創高；Nasdaq 期貨跌 0.61%。明天 14:00 台積電法說，月線 2,486.25 元是多空分界"
  ],
  "sentiment": {"us": "中性偏空", "tw": "中性"},
  "sections": [
    {
      "title": "台股收盤：量縮反彈，靠傳產撐場",
      "body_md": "昨天帶量長黑之後，今天指數收復約 3 成跌幅，但反彈的品質普通：\n\n- **量縮**：成交金額約 9,193 億元，比昨天少了一成多。上漲家數是下跌家數的 3 倍，買盤願意進場，但**大多是中小型股和傳產，權值股買盤不積極**\n- **權值股收最低**：台積電開 2,505 元、盤中最高 2,535 元，收 2,490 元平盤，**連兩天收在當日最低**；聯發科也是開高走低。指數盤中站上 49,000 點又跌回來，原因就是權值股拉不動\n- **位置**：指數在月線上方 1.33%，RSI 59.2，5 天仍跌 2.40%。月線還在，結構沒有被破壞\n\n**對照昨天的判斷**：昨天說法說前台積電要守住月線，今天守住了（只高出 0.15%），但還沒有真正站穩。昨天擔心外資再賣千億元等級，今天只賣 200 億元，這個風險暫時沒有發生。"
    },
    {
      "title": "資金流向：外資連六賣但金額收斂，內資接手",
      "body_md": "外資賣超 200.37 億元、投信買超 160.27 億元、自營商賣超 114.70 億元（避險部位賣 89.61 億元），**三大法人合計賣超 154.81 億元**，比昨天的近 2,000 億元大幅收斂。\n\n- **外資買原物料、賣半導體**：買超張數前幾名是中鋼 7.70 萬張、台塑 5.34 萬張、台玻 4.65 萬張、華新 2.84 萬張，都是原物料和傳產；賣超是南亞科 2.30 萬張、京元電子 2.27 萬張、聯電 1.60 萬張，還有台積電 6,752 張。京元電子有輝達預付美國測試產能的消息，外資還是照賣，**顯示外資在減碼整個半導體族群，不是針對單一公司的消息**\n- **內資和外資對作**：台塑化被外資賣 2.00 萬張，投信買進 1.41 萬張；0050 外資只賣 6,925 張，昨天是 10.61 萬張，整籃式的提款明顯放緩\n- **匯率**：台幣貶到 32.09 元，美元指數創 52 週新高。CPI 偏熱後美元走強，外資短期回補台股的誘因不高"
    },
    {
      "title": "類股與個股：塑化財報行情，光學題材退燒",
      "body_md": "**強勢**\n- **塑膠 +9.27%**：台塑四寶第三季自結獲利優於市場預期，台化漲停收 85.50 元（成交 87 億元），南亞漲 9.40%。南亞除了本業的高階銅箔基板，轉投資南亞科的獲利貢獻也大幅增加。外資同時買台塑，這波漲勢有基本面支撐，不完全是輪動\n- **電子零組件 +1.62%**：昨天重挫 5.36%，今天跌深反彈。國巨漲 4.67%，成交 295 億元；大毅、台虹漲停，被動元件和軟板領漲\n- **IC 設計小型股**：矽力-KY、智原漲停，但大型的聯發科跌 1.10%，大小型股走勢不同\n\n**弱勢**\n- **光學**：昨天攻上漲停的玉晶光，今天開 1,165 元就是最高，最後跌 9.36%；大立光跌 5.43%，成交約 300 億元。**昨天提到「開高走低、大立光翻黑代表獲利了結」，今天正是這樣**\n- **測試設備**：鴻勁跌 4.78%，和昨晚美股應材跌 6.69% 的設備股賣壓方向一致"
    },
    {
      "title": "美股盤前觀察：CPI 偏熱，殖利率創高壓科技股",
      "body_md": "**CPI 結果（台北 20:30）**：9 月 CPI 月增 0.6%、年增 3.7%，預期是 3.6%，8 月是 3.4%。核心 CPI 月增 0.3%、年增 2.6%，兩個數字都比預期高 0.1 個百分點。汽油上漲 9.1%，大約貢獻一半的漲幅，主要推力是能源，但**核心 CPI 也偏熱，市場很難把它解讀成單純的油價問題**。\n\n- **利率**：10 年債殖利率 5.31%，創 52 週新高；發布前市場認為 10 月 Fed 按兵不動的機率約 8 成，這個預期可能被重新評估\n- **期貨**：S&P 500 期貨跌 0.32%、Nasdaq 期貨跌 0.61%，高評價科技股壓力比較大；媒體報導美國銀行公布財報後股價重挫，銀行財報季的表現開始分歧\n- **晶片股**：昨天費半盤中跌 2%，收盤只跌 0.23%，比我們昨天預期的強。但應材跌 6.69%（1.72 倍量）、美光跌 3.62%、KLA 跌 3.22%，**設備和記憶體還沒止跌**\n- **台積電 ADR**：小漲 0.17%，換算溢價 14.73%。今晚 ADR 的收盤是明天法說前最後一個參考，溢價偏高，代表 ADR 如果下跌，還有一段空間"
    }
  ],
  "watchlist_notes": {
    "2330": "收 2,490 元平盤，盤中最高 2,535 元，連兩天收在最低；只在月線 2,486.25 元上方 0.15%，外資賣 6,752 張、投信買 800 張，量 1.2 倍。明天法說的第四季展望和資本支出決定能不能守住月線",
    "2317": "收 243 元，漲 1.25%，盤中最低 241 元，守住昨天提的 239 元；外資轉為小買 2,170 張。但仍在月線 249.95 元和季線下方約 3%，RSI 41.7，要先站回 250 元才算轉強",
    "2454": "收 4,475 元，跌 1.10%，開高走低收在最低，5 天跌 9.04%，在月線下方 7.14%，RSI 33.8 接近超賣；外資再賣 3,513 張。季線約 4,251 元是下一個支撐參考",
    "0050": "收 113 元，漲 0.53%，在月線 111.70 元上方 1.16%；外資賣超從昨天的 10.61 萬張降到 6,925 張，整籃提款放緩，量 0.86 倍。守住月線就還是多頭整理",
    "NVDA": "收 228.52 美元，漲 0.97%，剛好在月線 228.32 美元附近，量 0.79 倍；微軟推出自研 Maia 300 晶片，股價反應不大。今晚 Nasdaq 期貨偏弱，季線約 219.54 美元是支撐參考",
    "TSM": "收 445.12 美元，漲 0.17%，在月線 453.36 美元下方 1.82%，5 天跌 7.71%；溢價 14.73%，比台股本地股價強。今晚收盤和明天法說後的反應，會直接影響台積電週五開盤",
    "AAPL": "收 341.27 美元，漲 0.09%，再創 52 週新高，但昨天盤中漲 1.43%，收盤幾乎回吐；量 1.04 倍是正常水準，創高後追價力道普通",
    "MSFT": "收 543.45 美元，漲 0.43%，創 52 週新高（媒體說是近一年首次收盤創高）；在月線上方 5.69%，RSI 77.8 偏過熱。殖利率升到 5.31%，對高評價股是壓力，短線追高風險比較大"
  },
  "picks": [
    {"symbol": "1303", "market": "tw", "name": "南亞", "type": "強勢股", "reason": "漲 9.40% 收 349 元，成交 602 億元，金額僅次於台積電；第三季自結獲利亮眼，高階銅箔基板漲價加上南亞科的獲利貢獻，是今天塑膠類股大漲 9.27% 的主力", "watch_for": "兩天大漲後籌碼很熱，成交金額甚至超過聯發科；留意明天能不能守住今天開盤價 321 元附近，以及南亞科持續被外資賣超，會不會影響轉投資題材"},
    {"symbol": "2002", "market": "tw", "name": "中鋼", "type": "轉強觀察", "reason": "外資買超 7.70 萬張，是今天外資買超最多的個股；台塑、台玻、華新也在前五名，鋼鐵類股漲 1.56%，外資資金明顯轉向原物料", "watch_for": "外資會不會連續買超；如果只買一天就停，比較像避險換股，不是基本面轉向。另外留意原油和美元走勢對原物料價格的影響"},
    {"symbol": "2327", "market": "tw", "name": "國巨", "type": "轉強觀察", "reason": "漲 4.67% 收 627 元，成交 295 億元，在成交金額第五名；電子零組件昨天跌 5.36%，今天反彈 1.62%，大毅也漲停，被動元件是 AI 零組件中最先有買盤回來的", "watch_for": "這是跌深反彈還是止跌，要看明天能不能守住今天開盤價 605 元；如果台積電法說後電子股再跌，零組件族群可能再跌一次"},
    {"symbol": "3406", "market": "tw", "name": "玉晶光", "type": "轉弱警示", "reason": "昨天漲停，今天開盤就是最高，最後跌 9.36% 收 1,065 元，成交 116 億元；大立光也跌 5.43%、成交近 300 億元，CPO／光學題材有大量獲利了結的賣壓", "watch_for": "是否跌破今天最低 1,060 元並繼續帶量下跌；昨天把它列為事件驅動，今天走勢已經轉弱，判斷要調整"},
    {"symbol": "AMAT", "market": "us", "name": "應用材料", "type": "事件驅動", "reason": "跌 6.69% 收 464.24 美元，1.72 倍量，5 天跌 12.45%，在月線和季線下方都超過 5%；市場擔心 AI 資本支出，壓力集中在設備股", "watch_for": "明天台積電法說公布的資本支出會直接影響設備股：如果維持或上調，應材有機會止跌；如果下修，52 週低點 415.38 美元會是下一個參考"}
  ],
  "events": [
    {"time": "10/14 20:30", "title": "美國 9 月 CPI（已公布）", "note": "年增 3.7%，預期 3.6%；核心 2.6%，預期 2.5%。偏熱，殖利率升到 5.31%"},
    {"time": "10/14 21:30", "title": "美股開盤", "note": "看 10 年債能否站穩 5.31%，以及費半、應材、美光是否延續賣壓；銀行財報持續公布"},
    {"time": "10/15 09:00", "title": "台股開盤", "note": "台積電月線 2,486.25 元；外資賣超能否持續收斂到百億元以下"},
    {"time": "10/15 14:00", "title": "台積電第三季法說會", "note": "重點是第四季營收與毛利率展望、全年資本支出，以及先進封裝產能；會影響台股、ADR 和全球設備股"}
  ],
  "risks": [
    "殖利率突破：CPI 和核心 CPI 都比預期高，10 年債已到 5.31% 的 52 週高點。如果今晚收在 5.35% 以上，Fed 升息的討論可能再升溫，高評價 AI 股和台股電子權值會同時承壓，台幣也可能貶破 32.4 元的年高",
    "法說會落差：台積電只比月線高 0.15%，ADR 溢價 14.73%。如果第四季展望或資本支出低於預期，台積電容易跌破月線，ADR 也有修正溢價的壓力；設備股和京元電子等測試族群也會受影響",
    "塑化過熱：塑膠類股單日漲 9.27%，南亞的成交金額超過聯發科，媒體也提醒台塑的融資增加。如果油價從 95.66 美元回落，或電子股反彈讓資金撤出，追高的人容易套在高點",
    "外資賣超重新放大：外資已經連六賣，今天只是金額收斂，方向沒有改變。如果法說後外資又賣回千億元等級，今天這種量縮反彈很容易被抵銷"
  ]
}
