{
  "key": "2026-09-14-pm",
  "session": "pm",
  "headline": "油價破百＋升息機率衝 90%，台股殺低 690 點後急拉 V 轉",
  "summary": [
    "今日盤中一度重挫近 690 點、跌破 46,000 與月線，台積電最低 2,385 失守季線，隨後金融與聯發科翻紅帶動自低點急拉約 600 點收斂跌幅",
    "9/11 那場才是內傷：加權指數 -755.64 點（-1.61%）收 46,184.85，上漲 229 家對下跌 779 家，三大法人合計賣超 1,112.59 億，其中自營商避險單就佔 251.62 億",
    "美股 9/11 四大指數全紅是「油價退燒」給的，但 WTI 已回漲至 102.47、10 年期殖利率 4.97% 站在 52 週最高，Nasdaq 期貨此刻 -1.29%，方向要等 9/17 凌晨 FOMC"
  ],
  "sentiment": {
    "us": "中性偏空",
    "tw": "中性偏空"
  },
  "sections": [
    {
      "title": "台股：先殺 690 點再 V 轉，但上週五的傷口還在",
      "body_md": "**先說資料限制**：本報產出時（13:16）TWSE 今日收盤統計尚未公布，以下指數、成交量、漲跌家數與法人數字**全部是 9/11（五）那一場**，今日 9/14 的盤中走勢只能依盤中資訊描述，收盤數字請以官方公布為準。\n\n今日承接上週五賣壓開低走低，盤中一度重挫近 690 點、同時跌破 46,000 整數關與 20 日均線（46,025.29），台積電最低見 2,385 失守季線。之後金融股、聯發科、聯電翻紅，指數自低點急拉約 600 點、跌勢明顯收斂，盤中一度回頭挑戰月線。這是很典型的「FOMC 會前既不敢追、也不敢空」的震盤 —— 殺低有人接，但反彈也沒量，方向留給 9/17 凌晨。\n\n回頭看 9/11 才知道這根 V 轉守的是什麼：加權指數單日 **-755.64 點（-1.61%）收 46,184.85**，成交 6,820.94 億，上漲 229 家對下跌 779 家、漲停 8 家對跌停 7 家。指數距 52 週高點只剩 3.26%、YTD 仍 +41.62%、RSI 61，技術面其實沒壞 —— 壞的是籌碼和敘事。"
    },
    {
      "title": "類股與個股：AI 供應鏈失血，金融接棒",
      "body_md": "9/11 的類股表把故事講完了：**生技醫療 -3.17%、塑膠 -3.06%、電子零組件 -2.16%、半導體 -2.00%**，而**金融保險 +1.12%、航運 +1.04% 是唯二上漲**。這不是普跌，是資金從高評價的 AI 成長股，搬到「升息受益＋高股息」的金融股。\n\n傷最重的是 AI 訂單能見度那一塊：**世芯-KY 跌停 -9.99% 收 3,650，成交 208.02 億、全市場第四大**；新代 -9.93%、光聖 -7.22%、禾伸堂 -7.35%、國巨 -4.90%（197.33 億）。被動元件、ASIC、光通訊這些「靠 AI 資本支出吃飯」的族群，一遇到「AI 巨頭喊放慢」的說法，殺的是本益比不是當期基本面 —— 但也正因為是本益比，沒有訂單數字出來前很難說殺完了。\n\n逆勢站上去的是中砂 +7.78%（半導體耗材）、彰銀 +3.91%、兆豐金 +3.61%、全友 +6.62%、光罩 +4.60%。權值股方面台達電 -3.28%、聯發科 -2.86%、台積電 -1.63%，成交金額前五名有四檔是跌的，**量能是往下宣洩的，不是換手向上**。"
    },
    {
      "title": "資金流向：外資的避險單比現股賣超更值得看",
      "body_md": "9/11 三大法人合計賣超 **1,112.59 億**：外資 -892.70 億、自營商 -302.02 億、投信逆勢買超 82.14 億。\n\n關鍵在自營商那一筆的組成 —— **避險部位 -251.62 億，自行買賣只 -50.39 億**。也就是說這天的賣壓有很大一塊是選擇權／期貨避險衍生出來的現貨賣單，不是看壞基本面的長期減碼。這種部位在 9/16 台指期結算前有回補的可能，這也解釋了今天為什麼殺得深、拉得也快。\n\n外資的方向倒是很清楚：賣超前五是友達 101,829 張、元大台灣 50 反 1、元大台灣 50 正 2、0050（42,145 張）、力積電（39,065 張）；買超前五卻是陽明、台中銀、凱基金、合庫金、彰銀，清一色航運＋金融，投信同步買彰銀 7,592 張。**這是防禦性換股，不是撤出台股** —— 但也意味著只要升息預期還在，資金短期不會回頭抬 AI 權值股。"
    },
    {
      "title": "今晚美股：那根反彈是油價給的，現在油又漲回去了",
      "body_md": "9/11（五）美股四大指數全紅：**道瓊 +509.19 點（+0.98%）止住連四跌**、S&P 500 +0.86%、Nasdaq +0.96%、費半 +1.81%，VIX 重挫 11.21% 至 15.84。但那天反彈的理由是「油價自高點回落、市場看過 CPI」，不是升息疑慮解除 —— 同一天 **10 年期殖利率收 4.97%，正好是 52 週最高點（位置 100%）、RSI 73.6**。\n\n這個理由現在正在被拆掉：亞洲時段 **WTI 回漲 2.42% 至 102.47**（一個月 +26.12%、RSI 81），**Nasdaq 期貨 -1.29%、S&P 500 期貨 -0.54%**。羅素 2000 RSI 只有 30.9、在月線下 2.61%，小型股和內需其實早就在反映升息成本。今晚沒有重量級數據，盤面由油價、殖利率與 FOMC 前的部位調整主導。\n\n有一個矛盾訊號值得記下來：**DELL 上週五 +11.98%、創 52 週新高**，SMCI +7.28%、ARM +4.17%、Marvell +4.03% —— AI 伺服器實際需求跟「AI 放緩」的敘事之間有明顯落差。另一邊甲骨文量能放大到 2.98 倍卻收 -1.74%、52 週位置僅 26.5%，市場對「舉債擴資本支出」這個模式的耐心明顯比對「有訂單交機」的要少。台積電 ADR 溢價已達 13.97%，偏高，等於美股這邊對台積電的評價比現貨樂觀不少。"
    }
  ],
  "watchlist_notes": {
    "2330": "9/11 收 2,410（-1.63%）幾乎貼在月線 2,411 上、外資單日賣超 8,251 張，成交 510.50 億居冠但量比僅 1.06，今日盤中一度殺到 2,385 失守季線後拉回；ADR 溢價 13.97% 偏高，月線 2,411 與季線 2,400 這一帶是多空防線，周三另有除息（配息金額以公司公告為準）。",
    "2317": "248 元（-1.20%），52 週位置只剩 49.8%、一個月 -5.34%，量比 0.73 屬縮量整理，外資賣超 3,751 張但投信小買 410 張；在 AI 族群裡明顯落後，月線 249.90 先當壓力看，要等 iPhone 18 拉貨或機器人題材給出實際數字才有轉強理由。",
    "2454": "4,585 元（-2.86%）看似殺重，但仍高於月線 10.17%、52 週位置 94.7%、RSI 73 偏熱，YTD +183% 是今年最強權值股；外資只賣 742 張、投信買 108 張，籌碼沒鬆動，今日盤中率先翻紅帶反彈，回檔第一道防線看月線 4,161 附近。",
    "0050": "107.70（-1.33%），量比放大到 1.42、外資賣超 42,145 張排全市場第 4，但投信買 1,668 張；仍站在月線 106.58 之上、52 週位置 91.1%，是觀察大盤有沒有真破的最乾淨指標 —— 跌破 106.58 才算月線正式失守。",
    "NVDA": "218.29（-0.03%）平盤作收但五日 -4.45%、量比 0.70 縮量，在月線 220.16 之下、季線 210.55 之上盤整，RSI 52 中性；鴻海的拉貨訊號與「AI 放緩」的說法同時存在，210 這個季線是目前多空的分界。",
    "TSM": "433.24（+1.22%），逆著費半以外的雜音走強、量比 1.15，同時站上月線 421.71 與季線 423.84，52 週位置 56.9%；換算後對現貨溢價 13.97%，要注意的是今晚若 ADR 跟著期貨回檔，現貨明日的反彈空間會先被壓縮。",
    "AAPL": "332.27（+1.75%），一個月 +9.93%、52 週位置 88.0%、高於月線 4.94%，是這波亂局裡最穩的大型股之一；RSI 70.6 已進入超買區，量比 1.19，新機題材已反映不少，追價的風險報酬不如上個月。",
    "MSFT": "495.63（+0.65%），但五日 -2.84%、量比 0.70，剛好卡在月線 494.43 上緣，距 52 週高 513.53 約 3.5%；季線之上 12.64% 中期趨勢仍在，資料中心擴張的資本支出是市場現在最敏感的那條神經，494 失守就要小心。"
  },
  "picks": [
    {
      "symbol": "3661",
      "market": "tw",
      "name": "世芯-KY",
      "type": "轉弱警示",
      "reason": "9/11 直接跌停 -9.99% 收 3,650，成交 208.02 億是全市場第四大、單日 5.8 萬筆交易，開盤 3,870 就是當天最高點、收在最低點，是「AI 資本支出放緩」這個敘事在台股的震央。ASIC 設計代工的訂單能見度最依賴雲端業者的 capex 指引，敘事一轉，殺的是本益比。",
      "watch_for": "留意有沒有再見 3,650 這個跌停價、以及量能是否明顯縮到 100 億以下 —— 高檔跌停後若隔日開高走低伴隨大量，通常代表籌碼還在換手；反之縮量止跌才算初步止血。同時緊盯客戶端的資本支出發言。"
    },
    {
      "symbol": "2886",
      "market": "tw",
      "name": "兆豐金",
      "type": "防禦",
      "reason": "9/11 大盤殺 755 點，它逆勢 +3.61% 收 51.70、成交 18.27 億，金融保險類指數是當天唯二上漲的類股（+1.12%）。外資買超前五名有台中銀、凱基金、合庫金、彰銀四檔金控，投信同步買彰銀 7,592 張 —— 這是很明確的「升息受益＋高息避風港」換股，不是隨機反彈。",
      "watch_for": "這檔的多頭邏輯建立在升息預期上，所以真正的風險點在 9/17 凌晨 FOMC：若 Fed 沒升息或語氣轉鴿，金融股這波補漲的理由就會鬆動。留意 49.40（9/11 開盤價兼低點）是否失守。"
    },
    {
      "symbol": "1560",
      "market": "tw",
      "name": "中砂",
      "type": "強勢股",
      "reason": "9/11 在半導體類指數 -2.00% 的環境下逆勢 +7.78% 收 790、成交 31.87 億，當天低點 744、高點 794，收盤幾乎作在最高 —— 半導體耗材（再生晶圓／鑽石碟）的需求綁在晶圓廠的實際產能利用率，而不是雲端業者未來三年的資本支出承諾，這個差別正是現在市場在重新定價的東西。",
      "watch_for": "留意能不能站穩 744 這個 9/11 低點；耗材股的單日急拉常伴隨題材消息，要看第二天量能是否延續。若 AI 疑慮擴散到晶圓廠投片量的層次，這類「後段耗材」的防禦性也會失效。"
    },
    {
      "symbol": "DELL",
      "market": "us",
      "name": "Dell",
      "type": "強勢股",
      "reason": "9/11 單日 +11.98% 收 567.29、量比 1.63，52 週位置 100%（創新高），是掃描的 50 檔大型股中最強的一檔，SMCI +7.28% 同步走強。當市場正在恐慌「AI 伺服器需求放緩」，實際出貨端的股價卻創新高 —— 這個落差是台系伺服器代工（廣達、緯創、鴻海）接下來最直接的參考座標。",
      "watch_for": "RSI 71.2 已在超買區、單日漲近 12% 本身就是不穩定的訊號，留意隔日是否留下長上影線。更重要的是觀察這股強勢能不能擴散到台廠 —— 如果 DELL 續強而台系代工不動，代表市場認為毛利留在品牌端而非代工端。"
    },
    {
      "symbol": "ORCL",
      "market": "us",
      "name": "甲骨文",
      "type": "事件驅動",
      "reason": "9/11 量能放大到 2.98 倍（全掃描池最大），股價卻收跌 1.74% 至 150.28，52 週位置僅 26.5%。大量伴隨下跌、且位階已在低檔，通常是機構在重新評估持股，而不是散戶追殺。它是「靠舉債衝 AI 資本支出」這個商業模式的代表，市場現在對這種模式的耐心明顯低於對有實際交機的公司。",
      "watch_for": "留意在 10 年期殖利率 4.97% 的環境下，這類高槓桿 AI 資本支出股的信用成本敘事會不會被放大；若 FOMC 後殖利率再往上，它會是第一批承壓的標的。同時看 2.98 倍的大量是不是在做底部換手。"
    }
  ],
  "events": [
    {
      "time": "21:30",
      "title": "美股開盤（今日無重量級經濟數據）",
      "note": "Nasdaq 期貨 -1.29%、S&P 500 期貨 -0.54%，WTI 回漲至 102.47；盤面預期由油價、10 年期殖利率（4.97%，52 週高）與 FOMC 前部位調整主導"
    },
    {
      "time": "09/16 (三)",
      "title": "台指期 9 月結算＋台積電除息",
      "note": "自營商 9/11 避險部位賣超 251.62 億，結算前後是否回補，會影響指數在月線 46,025 附近的強弱；台積電除息金額以公司公告為準"
    },
    {
      "time": "09/17 02:00",
      "title": "Fed FOMC 利率決策與點陣圖",
      "note": "8 月 CPI 年增 3.4%、月增 0.4% 符合預期後，市場隱含升息機率一度升至近 90%（新聞資訊），是本週唯一的方向性變數"
    },
    {
      "time": "09/18 (五)",
      "title": "美股四巫日（期貨、選擇權同步到期）",
      "note": "與 FOMC 同週，量能與尾盤波動會被放大，留意指數期貨轉倉造成的異常走勢"
    }
  ],
  "risks": [
    "若 FOMC 真的升息、或點陣圖上調 2027 年利率路徑，10 年期殖利率已在 52 週最高 4.97%（RSI 73.6），評價壓縮對高本益比 AI 股的殺傷力最大；台股 9/11 跌最重的正是這一群。",
    "WTI 已站上 102.47、一個月漲 26.12%、RSI 81 明顯過熱，若油價續漲則通膨預期難降溫，Fed 轉鷹與成本墊高雙重夾擊塑化（9/11 塑膠類指數 -3.06%）與航運、觀光。",
    "「AI 資本支出放緩」目前還只是敘事；一旦變成實際訂單下修，ASIC、被動元件、光通訊（世芯 -9.99%、禾伸堂 -7.35%、光聖 -7.22%）會再殺一輪，且這次會是砍獲利預估而非只砍本益比。",
    "外資 9/11 賣超 892.70 億且已連續 2 日賣超，買超名單全是金融與航運 —— 若這個防禦性換股持續，即使指數守住月線 46,025，AI 權值股的反彈也會缺乏資金支撐。",
    "台積電 ADR 溢價達 13.97% 偏高，若今晚美股跟著期貨回檔、ADR 補跌收斂價差，現貨明日的反彈空間會先被壓掉一層。"
  ]
}
