{
  "key": "2026-10-13-pm",
  "session": "pm",
  "headline": "外資賣超522億，費半盤中再跌2.48%，台積電ADR跌破月線",
  "summary": [
    "**資料時間說明**：本報告的資料在 10/13 00:52（台北）擷取，台股 10/13 還沒開盤，台股數字仍是 10/12 收盤；美股是 10/12 盤中（約美東 12:50）的快照，不是收盤價",
    "10/12 三大法人數字補上了：外資賣超 521.98 億元、自營商賣 142.94 億元，投信買 71.41 億元，合計賣 593.51 億元，指數卻只跌 11.48 點。外資主要賣台塑、友達、鴻海，買金融與傳產；台積電被賣 9,423 張，不是賣超的主力",
    "美股盤中走勢分歧：道瓊漲 0.39%，費半跌 2.48%，美光、ARM、Marvell、英特爾都跌超過 3%。台積電 ADR 跌 1.41%，跌破月線，昨天午報提醒的風險正在出現。10/13 台股電子權值開盤的壓力比較大"
  ],
  "sentiment": {"us": "中性", "tw": "中性偏空"},
  "sections": [
    {
      "title": "台股 10/12 收盤補遺：法人賣 593 億，指數只跌 11 點",
      "body_md": "10/13 台股還沒開盤，這段補上昨天午報缺的法人資料。\n\n- **土洋對作很明顯**：外資賣超 521.98 億元，投信買超 71.41 億元。成交金額最終為 8,219.95 億元，比昨天午報擷取時的數字高，代表尾盤換手比原先估的更大\n- **外資賣的是什麼**：台塑 3.69 萬張、友達 2.63 萬張、鴻海 2.53 萬張、0050 2.30 萬張、力積電 2.26 萬張。外資買的是台新新光金、台泥、中鋼、凱基金、00919，**方向是從塑化與電子調節，轉進金融、原物料和高股息**\n- **台塑是土洋對作的焦點**：外資賣 3.69 萬張，投信買 1.91 萬張\n- **檢討昨天的判斷**：昨天擔心外資會大賣台積電與聯發科，結果台積電只被賣 9,423 張、聯發科 2,107 張，賣壓主要在台塑與鴻海。**外資大賣這點說對了，賣的標的看錯了**"
    },
    {
      "title": "技術面：過熱的指數碰上大額提款",
      "body_md": "指數 RSI 81.3，比昨天午報擷取時的值更高；距 52 週高點 49,822.55 點約 1%，距月線約 47,687.85 點的乖離 3.41%。\n\n外資單日賣超超過 500 億元，指數卻幾乎沒跌，靠的是投信、散戶和輪動資金接手。新聞也提到融資餘額創新高。**這種撐盤方式在短期內有效，但需要持續的新資金**。如果 10/13 外資繼續賣、電子權值又開低，0050 被法人合計賣超 6.71 萬張的籌碼流出會更明顯。\n\n台幣在 31.93 元，美元指數 102.56，處於 52 週高點。匯率還沒加速貶值，但美元強勢不利於外資回補。"
    },
    {
      "title": "美股盤中觀察：晶片股再跌，能源與 Meta 撐盤",
      "body_md": "以下是 10/12 美東約 12:50 的盤中數字，**不是收盤價**。\n\n- **半導體**：費半跌 2.48%，五天累跌 6.92%，跌破月線。美光跌 3.61%，RSI 32.4；ARM 跌 3.89%，RSI 22.7；英特爾跌 3.15%。CNBC 標題寫「Micron leads tech lower」，**記憶體股是這次賣壓的主軸**，但搜尋還沒找到美光的具體利空\n- **輝達**：跌 1.26%。新聞稱微軟的新一代自研 AI 晶片 Maia 300 部分採用台積電 2 奈米製程，並將大規模部署。這對輝達是競爭疑慮，對台積電則不一定是壞消息\n- **撐盤的族群**：Meta 漲 4.18%，同時在漲幅榜和量能放大榜；能源類股 ETF 漲 1.48%，創 52 週新高。WTI 原油漲 2.18% 到 93.85 美元，新聞稱伊朗認為美方對和平條件的回應「不足」\n- **市場情緒**：VIX 15.21 仍低，羅素 2000 接近 52 週低點，RSI 29.5。**這是資金在族群間輪動，不是全面避險**。今天債市因哥倫布日休市"
    },
    {
      "title": "10/13 台股看點：ADR 溢價收斂、記憶體股承壓",
      "body_md": "- **台積電**：ADR 盤中 446.92 美元，換算約 2,854 元，溢價從昨天約 13.9% 收斂到 12.36%。ADR 跌了，但溢價仍高，開低後還有緩衝。**2,500 元仍是 10/15 法說前的多空分界**\n- **記憶體與 IC 設計**：美光跌、ARM 跌，南亞科、華邦電、力積電，以及聯發科的開盤壓力比較大。外資 10/12 已經賣力積電 2.26 萬張\n- **可能接棒的族群**：金融股有外資買超，又有 10/14 美國銀行財報題材；油價上漲對航運和塑化的影響不一樣。**這些族群如果繼續撐住，指數可以用輪動消化電子股的賣壓**\n- 美股 04:00 收盤後，要確認費半與台積電 ADR 的收盤價，盤中數字可能還會變"
    }
  ],
  "watchlist_notes": {
    "2330": "10/12 收 2,540 元，外資賣 9,423 張、投信買 588 張。ADR 盤中跌破月線，換算價約 2,854 元，溢價收斂到 12.36%。10/15 法說前先看 2,500 元，以及月線約 2,476.5 元能不能守住。",
    "2317": "收 244.5 元，外資賣 2.53 萬張，是外資賣超第三大，股價同時在月線約 251.12 元和季線約 250.67 元下方。新聞提到 337 調查，在收回 250 元之前，走勢都偏弱。",
    "2454": "收 4,625 元，外資賣 2,107 張，在月線約 4,834.5 元下方。新聞稱有 8.6 萬名散戶逢低買進，但 ARM 和費半盤中走弱，短線支撐要看季線約 4,204 元。",
    "0050": "收 114.8 元，量是均量的 1.31 倍。外資賣 2.30 萬張，法人合計賣 6.71 萬張，投信買 3,650 張。RSI 76.7，距 52 週高點 116.5 元不遠，籌碼由法人流向散戶。",
    "NVDA": "盤中跌 1.26% 到 226.38 美元，略低於月線約 227.51 美元，五天跌 5.24%。微軟自研 Maia 300 晶片的報導帶來競爭疑慮，新聞把 225 美元視為短線支撐。",
    "TSM": "盤中跌 1.41% 到 446.92 美元，跌破月線約 451.92 美元，五天跌 8.00%。昨天提醒的風險正在出現，要看收盤能不能收回 450 美元附近。",
    "AAPL": "盤中漲 0.83% 到 339.42 美元，接近 52 週高點 341.07 美元。iPhone 18 Pro 砍單報導的影響已經被消化，新聞也有調高目標價的消息，對和碩等蘋果鏈有支撐。",
    "MSFT": "盤中漲 1.03% 到 540.57 美元，再創 52 週新高，比月線高 5.61%，RSI 77.7 偏熱。自研 AI 晶片的消息帶動買盤，短線過熱，追高的風險在上升。"
  },
  "picks": [
    {"symbol": "1301", "market": "tw", "name": "台塑", "type": "轉弱警示", "reason": "10/12 外資賣超 3.69 萬張，是全市場最多；投信反向買 1.91 萬張，土洋對作最明顯。上週漲幅很大，塑膠類股 10/12 也跌 1.75%。", "watch_for": "投信是否繼續承接外資的賣壓；油價漲到 93.85 美元，對塑化報價有支撐，但如果外資連續賣出，高檔換手可能變成回檔。"},
    {"symbol": "2887", "market": "tw", "name": "台新新光金", "type": "轉強觀察", "reason": "外資買超 3.72 萬張，排第一；凱基金也有 2.94 萬張的買超，金融保險類股 10/12 漲 2.87%。外資從電子轉進金融的方向很明確。", "watch_for": "10/14 美國大型銀行財報中的淨利息收入與信用品質；10 年債殖利率在 5.24% 的高檔，對壽險金控的評價是兩面刃。"},
    {"symbol": "MU", "market": "us", "name": "美光", "type": "轉弱警示", "reason": "盤中跌 3.61%，帶動晶片股走弱，股價在月線下方 4.78%，RSI 32.4，五天跌 6.77%。台股的記憶體族群直接受影響，外資 10/12 也賣了力積電 2.26 萬張。", "watch_for": "收盤能不能守住 1,000 美元附近，以及這次下跌有沒有具體利空（目前還不清楚原因）；南亞科、華邦電 10/13 開盤的反應。"},
    {"symbol": "META", "market": "us", "name": "Meta", "type": "強勢股", "reason": "盤中漲 4.18%，是大型股漲幅第一，也在量能放大榜第一，股價在月線上方 3.51%。晶片股走弱時，資金轉向平台股。", "watch_for": "資料內沒有明確的上漲原因，要看收盤能不能保住大部分漲幅；距 52 週高點 777.59 美元約 4%。"},
    {"symbol": "XOM", "market": "us", "name": "埃克森美孚", "type": "事件驅動", "reason": "盤中漲 1.96%，創 52 週新高，能源類股 ETF 也創新高。WTI 原油漲 2.18%，原因是伊朗回應和平條件的消息。", "watch_for": "RSI 84.1，非常過熱。如果伊朗談判轉好、油價回落，能源股最容易回吐；如果油價重回 100 美元，會推高 CPI 預期。"}
  ],
  "events": [
    {"time": "10/13 04:00", "title": "美股收盤（10/12 交易日）", "note": "確認費半、美光收盤，以及台積電 ADR 能不能收回月線約 451.92 美元"},
    {"time": "10/13 09:00", "title": "台股開盤", "note": "觀察電子權值開低的幅度，以及金融、航運能不能繼續撐盤；2,500 元是台積電的關卡"},
    {"time": "10/13 盤後", "title": "三大法人買賣超", "note": "外資在 10/12 賣超 521.98 億元之後，會不會繼續大賣"},
    {"time": "10/14 13:00 前後", "title": "ASML 第三季財報", "note": "歐股盤前公布；接單與 2027 年展望會影響半導體設備鏈和台積電法說前的情緒"},
    {"time": "10/14 20:30", "title": "美國 9 月 CPI", "note": "8 月年增 3.4%；如果再偏熱，加上油價走高，殖利率可能挑戰 5.31% 的前高"},
    {"time": "10/15", "title": "台積電第三季法說會", "note": "重點是第四季展望、資本支出、先進封裝產能，以及 2 奈米客戶（例如微軟 Maia 300）"}
  ],
  "risks": [
    "台積電 ADR 收盤若低於月線約 451.92 美元：台積電 10/13 可能直接測 2,500 元。指數 RSI 81.3 已過熱，回補 10/2 約 48,476 點缺口的機率會提高。",
    "外資連續提款：10/12 賣超 521.98 億元，美元指數 102.56 在 52 週高點。如果 10/13 外資再賣超 500 億元以上，台幣貶破 32 元，只靠投信和融資撐盤，力道會不夠。",
    "記憶體族群補跌：美光盤中跌 3.61%、RSI 32.4，費半五天跌 6.92%。如果美股收盤跌幅擴大，南亞科、華邦電、力積電與聯發科可能一起承壓。",
    "油價推升通膨預期：WTI 原油漲到 93.85 美元，伊朗談判有變數。如果 10/14 CPI 年增率高於 3.4%，又碰上油價走高，殖利率突破 5.31% 時，高本益比的 AI 股最容易受影響。"
  ]
}
