{
  "key": "2026-10-15-pm",
  "session": "pm",
  "headline": "費半重挫外溢，台股盤中崩逾1600點失守月線，台積法說定方向",
  "summary": [
    "**資料說明**：本期資料在 12:59 抓取，台股收盤資料尚未更新（trade_date 仍是 10/14），**今日收盤指數、成交量與三大法人都沒有資料**。以下台股走勢引用盤中新聞報導，收盤數字請以證交所公告為準",
    "費半昨晚重挫 4.30%，5 天累計跌 10.58%，台積電 ADR 跌 3.40%，韓股盤中重挫約 7%，晶片股賣壓擴散到整個亞洲。報導指出加權指數盤中一度跌超過 1,600 點、跌破 47,000 點，台積電最低到 2,420 元，**月線 2,486.25 元失守，最低點已經碰到季線 2,419 元附近**。昨天說「月線是多空分界、結構未破壞」，今天就被打破了，昨天的判斷太樂觀",
    "今天 14:00 台積電法說是方向的關鍵：第三季營收已公布、超過財測上緣，市場要看毛利率能不能接近外資預估的 67.5%，以及第四季營收展望。今晚 20:30 美國公布 PPI、零售銷售，Nasdaq 期貨跌 0.79%，美股盤前偏弱"
  ],
  "sentiment": {"us": "中性偏空", "tw": "偏空"},
  "sections": [
    {
      "title": "台股盤中：亞股晶片賣壓擴散，跌破月線",
      "body_md": "**先說明資料限制**：資料檔的台股段落仍是 10/14 收盤（加權收 48,625.83 點），**今日收盤、成交金額、漲跌家數、類股與三大法人都沒有資料**，以下只根據盤中報導描述走勢。\n\n- **跌幅**：開盤就跌到 48,383 點，盤中最多跌超過 1,600 點、跌破 47,000 點。報導的盤中數字 47,152.69 點（-3.03%）比月線 47,985.87 點低了約 1.74%，比季線 45,932.47 點還高約 2.66%。**短線從「守月線」變成「月線反壓、季線支撐」**\n- **權值股是主要跌點**：報導指出千金股盤中有 18 檔觸及跌停，拖累指數約 900 點；聯發科跌 315 元、連七天收黑；櫃買指數跌約 4%，比加權指數更弱\n- **抗跌族群**：多家金控股價創新高（玉山金、元大金、第一金、華南金），軟板與鋼鐵線材股有 7 檔逆勢漲停，和昨天外資買中鋼、賣半導體的方向一致\n\n**承認判斷錯誤**：昨天把量縮反彈解讀為「結構未破壞」、台股給中性，但美國 CPI 偏熱後隔夜費半跌 4.30%，量縮反彈很快就被跌破。"
    },
    {
      "title": "台積電法說：今天是方向的關鍵",
      "body_md": "法說在下午收盤後進行（14:00），**撰寫時還沒有法說內容**，盤後和今晚 ADR 的反應才是真正的答案。觀察重點：\n\n- **毛利率**：公司財測區間 65%–67%，外資預估 67.5%（工商時報）。2 奈米量產會稀釋毛利率，如果還能達到財測上緣，可以化解「AI 需求見頂」的疑慮\n- **第四季營收展望**：外資預估季增約 15%。過去一週費半跌超過 1 成，主因是 AI 資本支出的疑慮（甲骨文、戴爾、Marvell 昨晚都跌 8%–11%），**第四季展望和 2027 年資本支出的說法，比第三季財報本身更重要**\n- **ADR 溢價**：ADR 收 430 美元，換算台股價格 2,760.6 元，比昨天現股收盤 2,490 元溢價 10.87%；以盤中 2,420 元計算，溢價擴大到約 14%。**ADR 跌得比現股少，代表賣壓主要來自台股現貨的外資提款**。今晚 ADR 如果守住季線 429.21 美元，明天現股才有機會止跌\n- **川普因素**：川普造勢時再提台積電，說美國將掌握全球 50% 晶片產能。短期是話題，中長期要留意美國廠成本對毛利率的拖累"
    },
    {
      "title": "美股回顧與今晚盤前：AI 基建股退潮，資金躲進防禦股",
      "body_md": "昨晚美股的特色是**殖利率回落，科技股還是重挫**。10 年債殖利率從 5.22% 降到 5.19%，Nasdaq 仍跌 1.88%，標普跌 1.11%，創 7 月以來最大跌幅。這表示賣壓不只來自升息疑慮，**AI 基建鏈的評價也在修正**：\n\n- **跌最多**：戴爾 -11.27%、甲骨文 -8.83%、Marvell -8.73%、美超微 -8.42%、ARM -6.81%，都是 AI 伺服器和資料中心相關股。ASML、KLAC 量能放大下跌，半導體設備也被拖累\n- **漲最多**：UNH、LLY、沃爾瑪、好市多，必需消費 +2.22%、醫療 +2.53%，能源類股創 52 週新高，資金明顯轉向防禦股\n- **小型股**：羅素 2000 跌到 52 週新低，RSI 27.7，報導指出已進入修正區間。美國銀行爆量跌到 52 週新低，金融股內部也出現分化\n\n**今晚**：S&P 期貨跌 0.32%、Nasdaq 期貨跌 0.79%，科技股可能續弱。VIX 16.87，雖然大漲一成，但距離 52 週高點 20.66 還有空間，**美股的恐慌程度明顯低於亞股**。20:30 PPI 和零售銷售是升息押注的下一個關鍵。"
    },
    {
      "title": "資金流向：外資連六賣，今日可能延續",
      "body_md": "最新的法人資料是 10/14：外資賣超 200.37 億元（連六賣）、投信買超 160.27 億元、三大法人合計賣超 154.81 億元。**今日法人資料還沒有公布**。\n\n- **外資可能連七賣**：以今天權值股和千金股的跌幅來看，外資提款很可能擴大。10/13 外資單日賣超 1,653 億元，今天要看會不會再出現千億元等級的賣超，這是判斷是否「恐慌性出場」的指標\n- **匯率**：台幣 10/14 收 32.10 元，RSI 73.9，已經貶值過頭，外資匯出的壓力仍在。美元指數今天小跌 0.45%，暫時沒有雪上加霜\n- **避險資產分化**：黃金漲 1.45%，比特幣跌 2.48%，跌破 20 日均線。資金偏好傳統避險資產，風險偏好在下降\n- **內資的角色**：昨天投信買超 160 億元，今天金控股創新高，顯示內資在權值電子股和高股息、金融之間換股，不是全面撤出"
    }
  ],
  "watchlist_notes": {
    "2330": "盤中最低到 2,420 元（報導），跌破月線 2,486.25 元，已經碰到季線 2,419 元；10/14 外資賣 6,752 張。法說後能不能守住季線，是短線多空的關鍵",
    "2317": "10/14 收 243 元，比月線、季線都低約 3%，52 週位置只在 26.3%；昨晚戴爾、美超微重挫，AI 伺服器供應鏈短線氣氛差，219.5 元的年低是下一個支撐",
    "2454": "報導指出盤中跌 315 元、連七天收黑，換算約 4,160 元，已經跌破季線 4,251 元；外資 10/14 再賣 3,513 張，Google TPU 競爭疑慮還沒有消化",
    "0050": "資料檔只更新到 10/13，今天隨權值股走弱；10/14 外資賣 6,925 張、投信買 1,350 張，金融成分股創高是少數撐盤力量",
    "NVDA": "跌 3.16% 收 221.30 美元，跌破月線 228.69 美元，離季線 219.77 美元只差 0.70%；台積電法說的 AI 需求說法會直接影響它",
    "TSM": "跌 3.40% 收 430 美元，5 天跌 8.94%，剛好落在季線 429.21 美元附近；今晚是第一時間反映法說的價格，對台股換算溢價 10.87%",
    "AAPL": "逆勢漲 0.50%，收 342.96 美元、創 52 週新高，在科技股中有防禦性質；但摩根大通因 iPhone 疑慮調整目標價，追高要留意",
    "MSFT": "跌 1.80% 收 533.69 美元，從歷史高點回檔，RSI 71.2 仍偏熱；還在月線上方 3.35%，算是 AI 族群中較強勢的一檔"
  },
  "picks": [
    {"symbol": "2330", "market": "tw", "name": "台積電", "type": "事件驅動", "reason": "法說會當天跌破月線，ADR 溢價擴大到約 14%，表示賣壓來自台股現貨的外資提款，不是基本面轉差", "watch_for": "毛利率能否接近 67.5%、第四季營收季增能否達到約 15%；今晚 ADR 能否守住季線 429 美元，現股季線在 2,419 元"},
    {"symbol": "2002", "market": "tw", "name": "中鋼", "type": "轉強觀察", "reason": "10/14 外資買超 7.70 萬張居冠，今天盤中鋼鐵線材股逆勢漲停，資金從半導體轉向原物料的方向延續", "watch_for": "外資今天是否繼續買超；如果台股反彈時資金回流電子股，原物料股是否開高走低"},
    {"symbol": "2884", "market": "tw", "name": "玉山金", "type": "防禦", "reason": "大跌日金控股逆勢創新高，報導指出玉山金距離 50 元只差一步，存股資金在震盪時進場", "watch_for": "能否站上 50 元整數關卡；美債殖利率如果繼續走高，對金控持有的債券部位是兩面刃"},
    {"symbol": "ASML", "market": "us", "name": "ASML", "type": "轉弱警示", "reason": "爆量（量比 1.93 倍）下跌 3.94%，月線、季線都跌破，52 週位置只在 22.6%，半導體設備股走弱", "watch_for": "台積電法說如果下修資本支出，設備股會最先受影響；1,550.69 美元的年低是否守住"},
    {"symbol": "UNH", "market": "us", "name": "聯合健康", "type": "防禦", "reason": "漲 4.73% 居大型股漲幅之首，醫療類股漲 2.53%，資金從 AI 股轉向防禦股的代表", "watch_for": "能否站穩季線 392.92 美元；科技股如果反彈，防禦股的資金是否流出"}
  ],
  "events": [
    {"time": "14:00", "title": "台積電第三季法說會", "note": "毛利率財測 65%–67%，外資預估 67.5%；重點是第四季營收展望和 2027 年資本支出"},
    {"time": "20:30", "title": "美國 9 月 PPI、零售銷售、初領失業金", "note": "報導的預估值：PPI 月增 0.5%、核心 PPI 月增 0.3%"},
    {"time": "今晚", "title": "台積電 ADR 反映法說", "note": "季線約 429 美元，會決定明天台股開盤方向"},
    {"time": "週五", "title": "Fed 主席華許發言", "note": "Fed 進入靜默期前最後一次發言，會影響市場對 10 月升息的押注"}
  ],
  "risks": [
    "若今晚核心 PPI 月增高於 0.3%，加上 CPI 3.7% 偏熱，10 月升息押注可能進一步升溫（有報導估約 45%），10 年債殖利率重回 5.31% 新高，科技股評價會再受壓",
    "若台積電法說的毛利率或第四季展望不如外資預期，現股跌破季線 2,419 元，加權指數可能下探季線 45,932 點，比今天盤中低點再低約 2.6%",
    "若外資再出現 10/13 那種上千億元的賣超，加上台幣貶過 32.40 元的年高，就要防範外資持續匯出",
    "美國 AI 伺服器股（戴爾、美超微、甲骨文）如果持續重挫，鴻海、廣達等台灣伺服器代工廠會被連帶評價下修，即使財報不差"
  ]
}
