{
 "key": "2026-09-09-pm",
 "session": "pm",
 "headline": "【示範】台股收盤小漲，外資轉買超；今晚美國 CPI 前美股期貨持平",
 "summary": [
  "（示範文字）加權指數收漲，成交量 4,210 億，漲跌家數 512/401，廣度偏多。",
  "（示範文字）外資買超 86 億、投信買超 21 億，法人同步偏多。",
  "（示範文字）美股期貨持平，今晚 20:30 CPI 是關鍵。"
 ],
 "sentiment": {
  "tw": "中性偏多",
  "us": "中性"
 },
 "sections": [
  {
   "title": "台股收盤",
   "body_md": "（示範）指數開高走高，**電子權值股**領漲，航運、金融同步走強；成交量較昨日放大。\n\n- 收在 MA20 之上\n- 漲停 14 家、跌停 3 家"
  },
  {
   "title": "資金流向",
   "body_md": "（示範）外資買超 86 億，集中在台積電、聯發科；投信持續買超中小型電子股。自營商小幅賣超。"
  },
  {
   "title": "美股盤前觀察",
   "body_md": "（示範）美股期貨持平，市場等待 CPI。若數據溫和，費半有機會反彈；反之留意 AI 硬體股獲利了結。"
  }
 ],
 "watchlist_notes": {
  "2330": "（示範）ADR 折價，開盤可能低開；月線附近有支撐。",
  "NVDA": "（示範）財報前獲利了結壓力大，量比放大顯示換手積極。"
 },
 "picks": [
  {
   "symbol": "2382",
   "market": "tw",
   "name": "廣達",
   "type": "強勢股",
   "reason": "（示範）AI 伺服器出貨動能延續，昨日放量上漲且外資買超，站上所有均線。",
   "watch_for": "量能是否延續，若縮量回測 5 日線可留意。"
  },
  {
   "symbol": "2603",
   "market": "tw",
   "name": "長榮",
   "type": "轉強觀察",
   "reason": "（示範）航運指數連日走強，長榮成交金額擠進前五，資金有輪動跡象。",
   "watch_for": "運價指數週五公布。"
  },
  {
   "symbol": "XLU",
   "market": "us",
   "name": "公用事業 ETF",
   "type": "防禦",
   "reason": "（示範）美股風險偏好下降時，公用事業類股相對抗跌並創新高。",
   "watch_for": "殖利率若反彈將壓抑評價。"
  }
 ],
 "events": [
  {
   "time": "20:30",
   "title": "美國 8 月 CPI",
   "note": "市場預期年增 2.9%"
  },
  {
   "time": "14:30",
   "title": "TWSE 三大法人買賣超公布",
   "note": ""
  },
  {
   "time": "明日",
   "title": "台積電 8 月營收",
   "note": ""
  }
 ],
 "risks": [
  "（示範）CPI 若高於預期，降息預期降溫，成長股評價承壓。",
  "（示範）台股成交量若持續萎縮，反彈延續性存疑。"
 ]
}