{
  "key": "2026-09-09-pm",
  "session": "pm",
  "headline": "外資連四買 209 億、廣度翻正，台股量縮守住 4 萬 7；今晚看蘋果發表會與布蘭特破百",
  "summary": [
    "加權指數收 47,183.36（+77.58、+0.16%），盤中一度漲 442 點至 47,548 後午盤翻黑，尾盤靠權值回神收紅；成交 7,621 億較昨日 8,548 億明顯量縮，但漲跌家數 607 / 370、漲停 12 家、跌停 0 家，廣度比昨天健康得多。",
    "三大法人由昨日賣超 125 億轉為買超 220.8 億：外資買超 209.2 億連四買、投信翻多買超 30.4 億。外資買的是群創、友達（面板）與主動式 ETF，賣的是華邦電 5.8 萬張與金融股，昨日的記憶體主流今天被倒貨，資金明顯輪動到光電、板類與塑化。",
    "台積電 -0.20% 收 2,465、聯發科 -1.80% 收在最低、華邦電 -2.66%，三大成交股全數收黑，半導體類指數 -0.20%，今天是中小型股撐盤而非權值。美股盤前 Nasdaq 期貨 -0.43%、布蘭特站上 100 美元、美債 10 年殖利率 4.81% 創 52 週新高，今晚台北時間 01:00 蘋果發表會是唯一的正面催化劑。"
  ],
  "sentiment": {"us": "中性偏空", "tw": "中性偏多"},
  "sections": [
    {
      "title": "台股收盤：廣度修復、量能退潮，權值缺席的小漲",
      "body_md": "今天的盤面和昨天剛好相反：昨天是台積電獨撐、705 家下跌；今天是**台積電、聯發科、華邦電三大成交股全部收黑，指數卻靠 607 家上漲、12 家漲停撐住**。加權指數開高後最高 47,548（+442 點），12 點過後翻黑，收盤 +77 點守住 4 萬 7。成交 7,621 億比昨天縮了約 900 億，代表追價意願降溫，但也沒有恐慌性出貨。\n\n類股輪動很清楚：**光電 +3.55%**（群創、友達獲外資大買，玉晶光漲停創歷史新高）、**航運 +1.56%**、通信 +1.32%、**電腦週邊 +1.30%**（昨日 -4.13% 後的技術性反彈）、塑膠 +1.15%（油價題材）、電機 +1.13%、零組件 +1.07%。弱勢的是**金融 -1.47%**（外資賣超台新新光金、凱基金、玉山金、彰銀）、**生技 -2.37%**（藥華藥 -4.27%、沛爾生醫 -9.11%）與半導體 -0.20%。\n\n技術面：指數 RSI 68.1、距月線 +2.66%、位於 52 週區間 96.5% 處，5 日 +2.21%，仍是高檔震盪格局。今天量縮小漲、廣度改善，是**多方整理而非轉弱**；但只要權值不接棒，指數就很難有效突破 47,741 的歷史高點。"
    },
    {
      "title": "資金流向：外資連四買 209 億，但買賣單邊都在換股",
      "body_md": "三大法人合計買超 220.8 億，**外資買超 209.2 億（連四買）、投信翻多買超 30.4 億、自營商賣超 18.8 億**。金額看起來是大買，拆開內容卻是一場明顯的換股：\n\n- **買超**：群創 8.20 萬張（全市場第一）、主動統一升級50 6.57 萬張、友達 6.51 萬張、主動統一台股增長 1.95 萬張、新纖 1.80 萬張（漲停）。面板雙虎兩天合計被外資買了近 22 萬張，加上主動式 ETF 被大量申購，這是「找低基期落後股」加上「用 ETF 買大盤」的組合。\n- **賣超**：**華邦電 5.80 萬張**（昨天才買超 9.26 萬張，今天反手倒出六成），台新新光金 3.24 萬張、凱基金 2.19 萬張、玉山金 2.01 萬張、彰銀 1.29 萬張。金融股連日被減碼，可能與市場對央行是否升息半碼的分歧有關。\n- **自選權值**：台積電外資賣超 2,559 張、投信也小賣 229 張；聯發科外資賣超 758 張但投信買 173 張；鴻海外資買超 3,133 張；0050 外資買超 6,768 張。\n\n解讀：外資整體態度仍偏多（四天累計逾 500 億），但**對記憶體與權值採取「漲了就賣」**，持續買進的是面板、ETF 這類籌碼相對乾淨的標的。指數要再攻，需要外資回頭買台積電，而不是現在這種輪動式買法。"
    },
    {
      "title": "強弱勢個股：板類與蘋概接棒，記憶體與高價 AI 測試股退潮",
      "body_md": "**強勢**：\n- **台塑化** 漲停 87.5（+9.92%），布蘭特原油站上 100 美元、美軍對伊朗哈爾克島附近目標實施打擊，油價題材最直接的受惠股，成交 39 億。\n- **玉晶光** 漲停 1,110（+9.90%）創歷史新高，蘋果發表會前夕的光學鏡頭題材，成交 59 億；同為蘋概的鴻海只小漲 0.20%，市場押的是零組件而非組裝。\n- **南電** +8.29% 收 1,110、成交 135 億，加上**欣興** +4.09%（成交 212 億、全市場第五），ABF 載板雙雄同步放量，是今天最有「族群性」的強勢股。\n- **高力** +9.80% 收 1,345，新纖漲停，前者是 AI 散熱、後者是低價傳產補漲。\n- **聯電** +3.28% 收 141.5，成交 382 億、27 萬張為今日成交王，昨天外資賣超終止連三買後今天量價齊揚，成熟製程回補。\n\n**弱勢**：\n- **穎崴** -5.45% 收 7,280，昨日漲停後今天最高 8,260、最低 7,215，單日振幅逾 13%，成交 117 億，高價 AI 測試介面股籌碼明顯鬆動；志聖 -4.75% 同步。\n- **華邦電** -2.66% 收 183，開盤 190.5 就是全天最高，一路走低，外資倒出 5.8 萬張。\n- **聯發科** -1.80% 收 4,625，開盤 4,780 為全天最高、收在最低，RSI 77.8、距月線 +12.3%，高檔出現長黑 K。\n- **藥華藥** -4.27%、大量 -4.05%，生技與設備股同步修正。"
    },
    {
      "title": "美股盤前觀察：油價破百、殖利率創高，等蘋果開牌",
      "body_md": "**今日午報資料缺少 Nasdaq、費半、NVDA、MSFT、原油、美元/台幣、比特幣與 7 檔類股 ETF**（資料抓取不完整，非市場異常），以下以現有資料與早報數據補充。\n\n昨夜（9/8）美股：S&P 500 -0.58% 收 7,673.52（跌破月線、RSI 48.2）、道瓊 -1.18%、羅素 2000 -0.52%；依早報資料 Nasdaq -0.32%、費半 +1.30% 逆勢創波段高。掃描到的 28 檔大型股中，**科林研發 +4.15%、特斯拉 +3.98%、應用材料 +3.98%、ARM +3.74%、高通 +3.17%（量比 2.62 倍）**領漲，半導體設備與 AI 晶片是資金去處；**Airbnb -4.07%、Salesforce -3.90%、Adobe -3.47%、Coinbase -3.09%、Palantir -2.31%** 領跌，軟體與加密概念被拋售。科技 ETF +0.32%、必需消費 -0.66%、工業 -0.48%（RSI 26、一個月 -5.81%，已進入超賣區）。\n\n盤前三個負面訊號：**Nasdaq 期貨 -0.43%**（亞洲盤時段）、**布蘭特原油站上 100 美元**（CNBC、Benzinga 均報導中東緊張升溫）、**美債 10 年殖利率 4.81% 位於 52 週區間 100% 的位置**；VIX 升至 16.06（+2.16%）、黃金 4,438（+1.01%）反映避險需求回升。今晚美國沒有重要經濟數據，市場焦點是台北時間 10 日凌晨 01:00 的**蘋果「Surprise and shine」發表會**（首款折疊 iPhone、iPhone 18 Pro）。依過往經驗，蘋果發表會當天股價多半小跌，供應鏈「賣事實」的機率不低。\n\n台積電 ADR 昨收 439（+2.35%），以早報匯率 31.45 換算約 2,761 元、對今日現貨 2,465 溢價約 12%，溢價維持高檔代表海外資金對台積電仍比本地積極；今晚 ADR 若隨大盤回落，溢價收斂會直接壓到明早 2330 的開盤。"
    }
  ],
  "watchlist_notes": {
    "2330": "-0.20% 收 2,465，開 2,480、高 2,490、低 2,460，全天在 30 元區間內整理，成交 440 億但量比 0.96 沒有放量；外資賣超 2,559 張、投信賣超 229 張，籌碼小幅鬆動。距月線 +2.3%、RSI 64.1、52 週高點 2,510 就在頭上，ADR 溢價約 12% 是支撐，但要突破 2,510 需要外資回頭買。8 月營收預計本週公布。",
    "2317": "+0.20% 收 252，剛好站回月線（251.03）之上，外資買超 3,133 張，但成交量比只有 0.55，蘋果發表會前市場明顯觀望（分析師：不宜大幅押寶）。一個月 -4.18%、位於 52 週區間 53%，是四檔自選中最低基期的一檔；今晚折疊 iPhone 若定價與出貨量超預期，250 到 254 的整理區才有機會向上突破。",
    "2454": "-1.80% 收 4,625，開盤 4,780 為全天最高、收在最低，高檔長黑；RSI 77.8、距月線 +12.3%、位於 52 週區間 96%，過熱訊號累積。外資賣超 758 張、投信買超 173 張，籌碼還沒明顯翻空，但成交 253 億且量比 0.67 代表買盤退潮。5 日仍 +8.19%，短線觀察 4,600 整數關卡與 10 日線是否守住。",
    "0050": "收 109.65 持平（資料顯示前收 109.9，變動幅度接近零），高 110.6、低 109.5，外資買超 6,768 張、量比 0.71。RSI 72.4、距月線 +3.28%、位於 52 週區間 96%，就是大盤的縮影：漲不動但也沒跌。今天中小型股撐盤對 0050 貢獻有限，權值不動它就不動。",
    "NVDA": "今日午報資料未抓到 NVDA，依早報資料 9/8 收 225.73（-2.01%），在費半創高的日子逆勢下跌，資金往設備股與 AMD、INTC 輪動。距月線 +2.38%、RSI 54，技術面未破壞；今晚沒有公司事件，主要跟隨 Nasdaq 期貨（-0.43%）方向。",
    "TSM": "9/8 收 439（+2.35%），量比 1.41、RSI 67.7、距月線 +4.28%，5 日 +5.7% 遠強於台北現貨 5 日 +3.35%，溢價約 12%。今晚是溢價能否維持的關鍵：台北現貨今天小跌，若 ADR 跟隨美股回落 1% 以上，明早 2330 開盤壓力會浮現。",
    "AAPL": "9/8 收 316.22（-1.17%），距月線 +0.86%、RSI 55.9、位於 52 週區間 74.5%，發表會前的例行整理。今晚 01:00 發表首款折疊 iPhone 與 iPhone 18 Pro，Barron's 標題直言「可能是啞彈」，市場預期已偏保守，關鍵在折疊機定價與預購時程（傳 9/11 或 9/12 開放）。",
    "MSFT": "今日午報資料未抓到 MSFT，依早報資料 9/8 收 493.95（-1.15%），已跌破月線（495.1），5 日 -2.63% 是自選中最弱的美股。軟體股昨夜全面弱勢（Salesforce -3.9%、Adobe -3.47%），微軟缺乏新催化劑，利率創高環境下最容易被減碼；觀察 490 整數關卡。"
  },
  "picks": [
    {
      "symbol": "3481", "market": "tw", "name": "群創", "type": "轉強觀察",
      "reason": "外資買超 8.20 萬張居全市場之冠，友達同步買超 6.51 萬張，面板雙虎兩天合計被外資買進近 22 萬張，帶動光電類指數 +3.55% 成為今日最強類股；低基期加上外資連續大買，是目前資金輪動最明確的方向。",
      "watch_for": "外資能否連續第三天買超，以及面板報價是否有實質上調消息；低價股靠籌碼推升，一旦外資轉賣回檔會很快，留意量能是否維持。"
    },
    {
      "symbol": "8046", "market": "tw", "name": "南電", "type": "強勢股",
      "reason": "+8.29% 收 1,110、成交 135 億，加上欣興 +4.09%（成交 212 億、全市場第五），ABF 載板族群同步放量上攻，是今天少數有族群性而非單一個股題材的強勢股；AI 加速器對高階載板需求延續。",
      "watch_for": "今日高點 1,125 未收在最高，明日能否站穩 1,100 整數關卡；若欣興量縮回落，載板族群的短線資金可能只是一日行情。"
    },
    {
      "symbol": "2344", "market": "tw", "name": "華邦電", "type": "轉弱警示",
      "reason": "昨日外資買超 9.26 萬張、今日反手賣超 5.80 萬張，股價開盤 190.5 即為全天最高、一路走低收 183（-2.66%），成交 259 億仍是全市場第三，代表短線籌碼在高檔換手；昨天最集中的資金今天最先撤退。",
      "watch_for": "180 整數關卡是否守住；若明日再破 180 且外資續賣，記憶體族群（含南亞科）的短線行情要視為告一段落。"
    },
    {
      "symbol": "6505", "market": "tw", "name": "台塑化", "type": "事件驅動",
      "reason": "漲停 87.5（+9.92%）、成交 39 億，布蘭特原油站上 100 美元、美軍打擊伊朗哈爾克島附近目標，油價題材最直接的受惠股，塑膠類指數也同步 +1.15%；外資買超進榜。",
      "watch_for": "油價走勢是唯一變數：中東局勢若降溫或美國原油庫存數據（週三 22:30）意外增加，油價回落會讓漲停後的追價者第一個受傷。"
    },
    {
      "symbol": "QCOM", "market": "us", "name": "高通", "type": "強勢股",
      "reason": "+3.17% 收 174.09，量比 2.62 倍為掃描大型股中量能放大第一，距月線 +5.75%，與 ARM +3.74%、科林研發 +4.15% 同屬半導體資金輪動受惠股；費半在大盤下跌中逆勢創高，資金正從 NVDA 往二線晶片與設備股移動。",
      "watch_for": "RSI 71.5 已進短線過熱區、仍在季線（175.89）之下；今晚蘋果發表會若確認自研數據機擴大採用，對高通是負面消息，觀察能否守住 170。"
    }
  ],
  "events": [
    {"time": "今晚 22:30", "title": "美國 EIA 原油庫存週報", "note": "布蘭特已破 100 美元，庫存數據會直接影響油價與通膨預期"},
    {"time": "9/10 01:00", "title": "蘋果秋季發表會（Surprise and shine）", "note": "首款折疊 iPhone、iPhone 18 Pro；影響鴻海、玉晶光、台積電等供應鏈情緒，歷史上蘋果發表會當天股價多半小跌"},
    {"time": "9/10 盤前", "title": "台積電 8 月營收（預計本週公布）", "note": "7 月已創高，毛利率創新高的報導已先反映，留意月增率"},
    {"time": "9/10 20:30", "title": "美國 8 月 PPI", "note": "油價上漲後首份通膨數據，若偏高會提前推升隔日 CPI 的預期"},
    {"time": "9/11 20:30", "title": "美國 8 月 CPI", "note": "7 月通膨已加速，本次是 9/17 FOMC 前最後一份 CPI"},
    {"time": "週五", "title": "台灣央行升息半碼與否的關鍵數據", "note": "依經濟日報報導，金融股連日遭外資賣超或與此有關"},
    {"time": "9/18 02:00", "title": "Fed 九月 FOMC 決議", "note": "與四巫日同週，市場對「不動 vs 升息」分歧擴大"}
  ],
  "risks": [
    "布蘭特原油站上 100 美元且美軍對哈爾克島附近目標實施打擊，若油價續漲，週四 PPI 與週五 CPI 偏高的機率上升，美債殖利率 4.81% 已在 52 週高點，再上 4.9% 會直接壓縮高本益比的 AI 與台股評價。",
    "台積電、聯發科、華邦電三大成交股今天全數收黑，半導體類指數 -0.20%，指數靠中小型股撐盤；若權值明天續弱且外資對台積電由小賣轉大賣，47,000 整數關卡與月線（45,961）之間的回檔空間約 2.6%。",
    "高價股籌碼鬆動：穎崴單日振幅逾 13% 收 -5.45%、聯發科開高走低收最低且 RSI 77.8、距月線 +12.3%，高價 AI 股若集體修正會拖累市場情緒，即使廣度仍好。",
    "蘋果發表會「賣事實」風險：玉晶光漲停創新高、鴻海觀望，若折疊 iPhone 定價或出貨不如預期，蘋概股明早可能反向；Nasdaq 期貨 -0.43% 加上 VIX 回升，今晚美股若再跌會直接反映在明日台股開盤。"
  ]
}
