{
  "key": "2026-10-08-pm",
  "session": "pm",
  "headline": "外資賣超758億、法人合計賣915億，台股連假前跌492點破五日線",
  "summary": [
    "加權指數開在全天最高點，一路走低收 49,313.44 點、跌 0.99%，跌破五日線（約 49,426 點）。5 萬點連三天沒站上，這是 10/5 大漲以來第一根明顯的實體黑 K",
    "三大法人合計賣超約 915.75 億元，其中外資賣超 758.52 億元、自營商賣超 187.31 億元，投信小買 30.09 億元。外資賣超台積電約 1.23 萬張、0050 約 5.15 萬張，明顯是整批調降台股部位，不是只賣個別股票",
    "外資在賣，但仍有選擇性加碼：南亞科、台塑、緯創被外資買超，南亞科與台塑也逆勢收紅。台股 10/9–10/11 休市，今晚美股開盤後費半又跌 1.13%、ADR 跌 0.64%，10/12 台積電開盤仍有壓力"
  ],
  "sentiment": {
    "us": "中性",
    "tw": "中性偏空"
  },
  "sections": [
    {
      "title": "台股收盤：開最高、收近最低，量縮但法人大賣",
      "body_md": "**開盤 49,783 點就是全天最高點**，盤中最低 49,189 點，收盤接近最低。過去三天都是盤中衝 5 萬點、尾盤拉回，今天連往上衝都沒有，**5 萬點前的高檔震盪轉成回檔**。\n\n- **跌破五日線**：這是 10/5 大漲 1,236 點以來，第一次收在五日線（約 49,426 點）下方\n- **成交約 8,547 億元**，比昨天約 9,245 億元少，連續縮量。不過法人一天賣超超過 900 億元，代表賣壓主要來自大型法人調整部位，散戶並沒有恐慌殺出\n- **類股**：光電 -2.02%、**金融 -1.68%**、半導體 -1.18%，權值類股全面走弱；只有通信網路 +1.02%、塑膠 +0.50% 收紅\n\nRSI 從 89.9 降到 81.3，過熱稍有降溫，指數仍在月線約 47,688 點上方 3.41%。**昨天提醒「台積電跌破 2,560 元，雙頂型態會更明確」，今天台積電開在 2,550 元、也收在 2,550 元，這個情境成立了。**下一個要看的是 10/2 收盤約 48,476 點的跳空缺口會不會被回補。"
    },
    {
      "title": "資金與籌碼：外資連假前整批減碼",
      "body_md": "**法人合計賣超約 915.75 億元**，是近幾天最大的一筆。連同前兩天，法人三天合計賣超超過 1,340 億元，連假前籌碼明顯偏空。\n\n- **外資賣超 758.52 億元**，賣超前幾名有友達（約 5.95 萬張）、**0050（約 5.15 萬張）**、凱基台灣TOP50、主動中信台灣收益、鴻海（約 2.56 萬張），台積電也被賣超約 1.23 萬張。**同時賣超台股大型 ETF 和權值股，比較像是整體降低台股部位**，不是只換股\n- **自營商避險部位賣超約 166 億元**，連假前期貨、權證的避險部位也一起減少\n- **外資有買的**：主動統一升級50（約 3.01 萬張）、**南亞科（約 2.18 萬張）**、中石化、緯創、**台塑（外資約 1.42 萬張、投信約 1.39 萬張，兩者同步買超）**。資金只集中在記憶體、塑化兩個族群\n- **台幣貶到 31.91**（+0.43%），跟外資匯出的方向一致\n\n台積電 9 月營收（新聞稱逾 5,118 億元、創歷年同期新高）在收盤後公布，**今天的股價沒有反映**，要到 10/12 開盤才看得到市場反應。"
    },
    {
      "title": "強弱勢個股：記憶體、塑化續強，高價 AI 股續弱",
      "body_md": "**強勢**\n- **南亞科 +3.50%** 收 532 元，成交約 343 億元居全市場第三，是成交前五大中唯一收紅的。外資買超約 2.18 萬張，前一晚美光大漲，記憶體是今天唯一有基本面和外資資金一起支撐的族群\n- **台塑 +7.82%** 收 81.3 元，成交約 196 億元，新聞稱創逾 3 年新高。盤中最高 82.4 元，沒有再鎖住漲停；塑膠類股只漲 0.50%，族群跟漲力道變弱。**今晚 WTI 原油漲 4.13% 到約 91.93 美元**，連假期間的油價走勢對台塑有利\n- 台亞、騰輝電子-KY 漲停，目前查不到明確的消息原因，看起來是短線題材資金\n\n**弱勢**\n- **川湖連兩天跌停**收 10,615 元，成交約 214 億元。盤中跌停曾經打開，最後還是收在跌停\n- **聯發科 -3.00%** 收 4,690 元、收在當天最低點，跌破月線 4,835 元，外資與投信同步賣超\n- **被動元件回吐**：國巨 -1.85%（盤中最低 619 元）、華新科 -1.87%（盤中最低 400 元）。昨天提醒國巨若跌破 630 元、華新科可能跟著回吐，今天國巨盤中確實跌破，雖然收盤拉回到 635 元，兩檔仍一起收黑"
    },
    {
      "title": "今晚美股觀察：開盤小跌，費半與 ADR 再走弱",
      "body_md": "以下是**美股開盤約一小時**的數字，終場可能會變（昨天終場跌幅就比盤中小）。\n\n- **大型指數小跌**：S&P 500 -0.19%、Nasdaq -0.31%，但**費半又跌 1.13%**，ARM -4.03%、英特爾 -3.05%、Marvell -2.83%、美超微 -3.39%，半導體連兩天走弱\n- **台積電 ADR -0.64% 收約 469 美元**，換算溢價約 17.42%。另有新聞稱格芯與台積電簽約 5 年、約 20 億美元，生產 CoWoS 矽中介層，對台積電的先進封裝產能是正面消息\n- **類股輪動**：能源 +2.56%（雪佛龍 +3.06%、埃克森美孚 +2.61%）、必需消費 +1.21% 領漲；醫療 -1.77%（禮來 -3.65%）。資金往防禦和油價相關族群移動\n- **小型股再創新低**：羅素 2000 跌 0.56%，又創 52 週新低，不動產 ETF 也在 52 週低點。10 年債殖利率 5.28%，離 52 週高點 5.31% 很近；新聞稱 Fed 會議紀要提到年底前可能再升息一次，**利率仍是主要壓力**\n\n台股休市期間，美股還有今晚、明晚兩個交易日。**10/12 台積電的開盤方向，取決於 ADR 這兩天累計漲跌與 9 月營收哪個影響比較大。**"
    }
  ],
  "watchlist_notes": {
    "2330": "跌 1.35% 收 2,550 元，開盤價就是最低價也是收盤價，跌破昨天提醒的 2,560 元；外資賣超約 1.23 萬張、投信小買約 790 張，仍在月線約 2,477 元上方 2.97%，收盤後公布的 9 月營收要到 10/12 才會反映。",
    "2317": "跌 1.19% 收 249 元，跌破 250 元整數關卡，也跌破月線（約 251 元）與季線（約 251 元）；外資賣超約 2.56 萬張，是外資賣超前五名中唯一的電子權值股，短線轉弱，下一個重點是 11/12 法說會。",
    "2454": "跌 3.00% 收在當天最低 4,690 元，跌破月線 4,835 元，外資與投信同步賣超；五天跌 5.82%、量能 1.25 倍，是有量的下跌，下一個參考是季線約 4,204 元。",
    "0050": "跌 0.95% 收 114.95 元，量能放大到均量 1.36 倍，外資賣超約 5.15 萬張，是今天被賣最多的權值 ETF；RSI 80.4 仍偏熱，距月線約 110.93 元乖離 3.62%。",
    "NVDA": "今晚開盤約一小時小跌 0.33% 至約 236.68 美元，量能偏低；仍貼近 52 週高點 239.24 美元、RSI 72.9 偏熱，費半走弱時輝達相對抗跌。",
    "TSM": "今晚開盤後跌 0.64% 至約 469.17 美元，跌破 470 美元，溢價約 17.42%；格芯 CoWoS 中介層合約是正面消息，但 ADR 尚未反映，這兩晚收盤價會直接影響 10/12 台積電開盤。",
    "AAPL": "小漲 0.33% 至約 337.77 美元，站在月線約 335.04 美元上方，RSI 52.1 中性；距 52 週高點 341.07 美元約 1%，科技股回檔時走勢偏防禦。",
    "MSFT": "小漲 0.22% 至約 530.91 美元，盤中再創 52 週新高，是自選股中結構最強的一檔；RSI 78.9 偏熱，距月線約 508.54 美元乖離 4.40%，留意月底財報前的獲利了結。"
  },
  "picks": [
    {
      "symbol": "2454",
      "market": "tw",
      "name": "聯發科",
      "type": "轉弱警示",
      "reason": "跌 3.00% 收在當天最低 4,690 元，跌破月線 4,835 元，外資與投信同步賣超；成交約 421 億元居全市場第二，五天跌 5.82%，昨天的轉弱警示已經成立。今晚 ARM 又跌 4.03%，手機與 ASIC 相關股的氣氛偏弱。",
      "watch_for": "10/12 能否收回月線 4,835 元；若繼續收在當天低點，代表高價 IC 設計股進入修正，下一個參考是季線約 4,204 元。"
    },
    {
      "symbol": "2059",
      "market": "tw",
      "name": "川湖",
      "type": "轉弱警示",
      "reason": "股王因 9 月營收月減連兩天跌停，收 10,615 元；今天跌停曾經打開、成交約 214 億元，有承接買盤，但不夠多，最後還是收在跌停。",
      "watch_for": "連假後第一天會不會第三天跌停；若跌停打開、收盤離開跌停價且量能維持，賣壓才算暫時告一段落。連假期間其他高價 AI 股的 9 月營收若也月減，留意跟著下跌。"
    },
    {
      "symbol": "2408",
      "market": "tw",
      "name": "南亞科",
      "type": "強勢股",
      "reason": "外資賣超 758 億元的一天，南亞科仍獲外資買超約 2.18 萬張，逆勢漲 3.50% 收 532 元，成交約 343 億元，是成交前五大中唯一收紅的，也是外資今天少數明確加碼的電子股。",
      "watch_for": "台股休市期間美光這兩晚的走勢，以及南亞科 9 月營收；若美光隨費半回吐，10/12 這波逆勢走強可能只是連假前的短線資金。"
    },
    {
      "symbol": "1301",
      "market": "tw",
      "name": "台塑",
      "type": "事件驅動",
      "reason": "連兩天大漲，今天 +7.82% 收 81.3 元、創逾 3 年新高，外資與投信同步買超各約 1.4 萬張；今晚 WTI 原油漲 4.13% 至約 91.93 美元，連假期間油價走勢對塑化股有利。",
      "watch_for": "族群跟漲變弱（塑膠類股只漲 0.50%）；10/12 若開高走低、跌破今天開盤價 78 元，代表短線追價資金在撤出。油價若回落到 88 美元以下，題材可能降溫。"
    },
    {
      "symbol": "2409",
      "market": "tw",
      "name": "友達",
      "type": "轉弱警示",
      "reason": "外資今天賣超約 5.95 萬張，居個股賣超第一；新聞稱外資已連 4 天賣超面板雙虎合計逾 45 萬張，光電類股跌 2.02%，是今天最弱的類股。",
      "watch_for": "外資連假後是否繼續賣超；若賣超張數縮小、股價止跌，才代表外資調節告一段落，在那之前籌碼面仍偏空。"
    }
  ],
  "events": [
    {
      "time": "10/8 21:30 起",
      "title": "美股 10/8 交易（台股休市前最後一晚）",
      "note": "開盤後費半 -1.13%、台積電 ADR -0.64%，留意終場能否收斂跌幅；10 年債殖利率 5.28% 貼近 52 週高點"
    },
    {
      "time": "10/9–10/11",
      "title": "台股國慶連假休市",
      "note": "美股 10/9 照常交易，台股 10/12 開盤一次反應兩晚的 ADR 漲跌與台積電 9 月營收"
    },
    {
      "time": "10/10 前",
      "title": "上市櫃公司 9 月營收公布期限",
      "note": "台積電已在今天收盤後公布；月減的高價股可能和川湖一樣在 10/12 開盤反應"
    },
    {
      "time": "10/12",
      "title": "台股連假後開盤／美國哥倫布日",
      "note": "美股照常交易、美國債市休市；同時看外資是否回補今天賣超的 0050 與台積電"
    },
    {
      "time": "10/15",
      "title": "台積電第三季法說會",
      "note": "9 月營收據報優於法人第三季預期，法說前的預期與第四季展望是權值股方向的關鍵"
    }
  ],
  "risks": [
    "連假開盤跳空風險：台股休市期間美股還有兩個交易日，台積電 ADR 溢價約 17.42%。若 ADR 兩晚累計再跌 3% 以上，10/12 台積電可能直接開低、跌破 2,500 元，指數回補 10/2 收盤約 48,476 點跳空缺口的機率提高。",
    "外資賣超延續：今天外資賣超 758.52 億元，主要賣的是 0050、台積電等大型權值部位。若 10/12 開盤後外資仍單日賣超 300 億元以上、台幣持續貶破 32 元，指數可能下測月線約 47,688 點（離今天收盤約 3.3%）。",
    "殖利率突破：10 年債 5.28% 距 52 週高點 5.31% 只差 3 個基點，Fed 紀要已提到年底前可能再升息。若殖利率突破 5.31%，羅素 2000 已在 52 週新低，賣壓可能從小型股擴散到 RSI 超過 70 的輝達、微軟、台積電 ADR。",
    "高價 AI 股營收殺盤擴散：川湖連兩天跌停、聯發科跌破月線，今晚美股 ARM、Marvell、美超微也走弱。連假期間公布的 9 月營收若有更多高價 AI 股月減，10/12 可能出現權值股與高價股同步修正。"
  ]
}
