{
  "key": "2026-09-09-am",
  "session": "am",
  "headline": "油價逼近百元、殖利率走高壓垮道瓊，費半逆勢創高；台積電 ADR 漲 2.35%，今日台股看權王撐盤、電子代工承壓",
  "summary": [
    "美股連假後首日三大指數收黑，道瓊重挫 628 點（-1.18%）為近三週最差，主因 Brent 原油逼近 100 美元、美債 10 年殖利率升至 4.81%，通膨與升息疑慮重燃；費城半導體卻逆勢 +1.30% 站上 11,888，AI 晶片股（INTC +9.05%、AMD +5.90%）獨強。",
    "台股週一收 47,105.78（-220.49、-0.47%），尾盤急殺但守住 4 萬 7；成交 8,548 億放量，漲跌家數 282 / 705 廣度偏弱，電腦週邊類股 -4.13% 最重（緯創宣布 15 億美元海外增資）。外資買超 132.7 億連三買，集中華邦電、友達等記憶體與面板股。",
    "台積電 ADR +2.35%、台指期夜盤約 +100 點，今日開盤有權值撐盤條件；但大盤 RSI 68.8、位於 52 週高低區間 96% 處，追價空間有限，留意電子代工與零組件是否延續昨日弱勢。"
  ],
  "sentiment": {"us": "中性偏空", "tw": "中性"},
  "sections": [
    {
      "title": "美股回顧：油價與利率重新定價，資金躲進晶片與能源",
      "body_md": "連假後第一天，市場焦點不在企業而在**通膨變數**：中東能源設施遇襲推升 WTI 至 94.16（+1.21%，5 日 +4.37%），Brent 逼近 100 美元；美債 10 年殖利率升至 4.81%，一週漲了 1%。這組合直接打到利率敏感族群 — 道瓊 -1.18%、金融 ETF -1.38%、醫療 -2.52%（Amgen 領跌）、羅素 2000 -0.52%。VIX 反彈至 15.72，但仍在低檔，市場是「調整」不是「恐慌」。\n\n相對地，**費半 +1.30% 逆勢創高**，接近 12,000 關卡。Citi 上調晶片產業展望，INTC +9.05%、AMD +5.90%、LRCX / AMAT +3.98%、QCOM 量比 2.62 倍 +3.17%，半導體設備與 AI 晶片明顯有資金持續流入；NVDA 卻 -2.01%，顯示資金在 AI 族群內部**從龍頭往二線與設備輪動**。能源（+1.11%）與公用事業（+0.86%）是另外兩個正報酬類股，防禦與通膨受惠並存。\n\n期貨盤前持平（ES +0.02%、NQ +0.08%），美股今晚沒有明顯方向，關鍵在油價能否降溫。"
    },
    {
      "title": "台股展望：權王撐得住，但廣度說了實話",
      "body_md": "週一大盤 -220 點，看似只跌 0.47%，但**下跌家數 705 家是上漲 282 家的 2.5 倍**，跌停 4 家、漲停 6 家，成交量放大到 8,548 億 — 這是「權值股撐、中小型股跌」的典型結構。台積電 +0.41% 獨撐大局（成交 717 億、外資買超 5,497 張），半導體類指數才勉強 +0.21%；電腦週邊 -4.13%、電子零組件 -2.84%、通信網路 -1.81% 則是主要拖累，導火線是緯創宣布 15 億美元 GDR 海外增資，外資賣超緯創 4.6 萬張，連帶壓到廣達、緯穎等 AI 代工。\n\n今日開盤的正面因子：台積電 ADR +2.35%（換算台幣約 2,761、對現貨溢價 11.8%，溢價較前日擴大）、台指期夜盤約 +100 點、費半創高、台幣走強（USD/TWD 31.45，一週升值 0.72% 代表外資匯入持續）。負面因子：大盤 RSI 68.8、距月線 +2.68%、位於 52 週區間 96%，加上當沖占比破四成，**漲多之後的震盪會比較大**。\n\n觀察重點：1）加權指數能否收復 47,326（週一前的收盤）— 站回代表昨日只是洗盤；2）電腦週邊類股是否止跌 — 若廣達、緯穎續弱，AI 代工的籌碼鬆動要多看兩天；3）記憶體族群（華邦電、南亞科）能否延續量能 — 昨日兩檔合計成交 826 億，是全市場資金最集中的地方。"
    },
    {
      "title": "資金流向：外資連三買 132 億，但買的不是台積電",
      "body_md": "三大法人合計賣超 125 億，拆開看卻很不一樣：**外資買超 132.7 億（連三日買超）**、投信賣超 72 億、自營商賣超 185 億（含避險部位，通常反映權證與期貨避險調整，參考價值較低）。\n\n外資買超集中在**華邦電 9.26 萬張、友達 8.52 萬張、南亞科 3.43 萬張、臺企銀 2.68 萬張、0050 2.09 萬張** — 記憶體、面板、金融、ETF，是「找落後補漲」的買法而不是追 AI 龍頭。賣超則是**聯電 6.39 萬張（終止連三買）、緯創 4.61 萬張、群創 4.21 萬張、仁寶、英業達** — 成熟製程與電子代工被減碼。\n\n投信轉為賣超 47 億（依新聞口徑），但仍買超台積電 1,205 張；季底作帳行情通常九月中旬後才明顯，現在投信偏向調節。整體解讀：外資態度仍偏多但**選股在輪動**，指數要再上攻需要台積電以外的第二引擎，記憶體與金融是目前最有量的候選。"
    },
    {
      "title": "總經與跨市場：三個要盯的數字",
      "body_md": "- **美債 10 年殖利率 4.81%**（5 日 +1.01%）：Fed 官員鷹派發言與川普要求「全球最低利率」的矛盾，讓九月 FOMC 變數增加；殖利率若再上 4.9% 會壓到高本益比的 AI 與台股（大盤本益比已破 40 倍）。\n- **WTI 94 / Brent 近 100**：油價是這波修正的源頭。對台股而言，塑膠（+0.66%）與航運受惠，但航空、電子零組件成本承壓；也會影響週五央行是否跟進半碼升息的判斷。\n- **USD/TWD 31.45**（5 日 -0.72%）：台幣升值同步外資匯入，是台股資金面仍正面的證據；黃金 4,417 續創高、比特幣 78,888 一週 -2.9%，風險偏好中性。"
    }
  ],
  "watchlist_notes": {
    "2330": "ADR +2.35% 且溢價擴大到 11.8%，今日有開高條件；外資買超 5,497 張、投信同步買超，籌碼穩。2,470 站在月線上 2.6%、RSI 67.6，不是追價位置，但只要守住 2,400 整數關卡多方結構不變。留意 9/10 前後的 8 月營收。",
    "2317": "-1.76% 收 251.5，正好壓在月線（-0.17%），5 日、1 月都是負報酬，外資賣超 1.33 萬張是四檔自選中籌碼最弱的。從 6 月高點 314 回檔兩成，8 月營收亮眼卻漲不動，市場在等 iPhone 18 出貨與 AI 伺服器毛利證據；跌破 250 就要看 240 的支撐。",
    "2454": "-1.05% 收 4,710，但 1 個月 +18.9%、今年 +177%、距月線 +15.2%、RSI 75.1，已在過熱區且被列注意股。昨日成交 309 億全市場第四，外資、投信都還小幅買超，籌碼未鬆動；策略上是「持有不追」，回測 10 日線（約 4,400）才是觀察點。",
    "0050": "-0.23% 收 109.65，外資買超 2.09 萬張進前五，反映外資用 ETF 布局權值。年初至今 +44.8%、RSI 65，走勢就是大盤的鏡子；注意它今年殖利率僅約 2%，是賺價差工具。",
    "NVDA": "-2.01% 收 225.73，在費半創高的日子逆勢下跌，資金明顯往 INTC / AMD / 設備股輪動。5 日仍 +2.24%、RSI 54、位於 52 週區間 78%，技術面沒壞。明天 9/10 有市場高度關注的事件（多篇報導點名），波動會放大。",
    "TSM": "+2.35% 收 439，量比 1.41 倍、RSI 67.7，突破早期買點（IBD 報導）。5 日 +5.7% 遠強於台北現貨 +1.2%，溢價擴大代表海外資金比本地更積極 — 對今日 2330 是正面訊號，但也意味 ADR 短線漲多。",
    "AAPL": "-1.17% 收 316.22，發表會前的例行整理（歷史上蘋果發表會當天股價多半小跌）。距 52 週高點約 5%，焦點是 2,000 美元可折疊 iPhone 的定價與供應鏈（鴻海、台積電）；5 日 -0.2% 持平，等事件。",
    "MSFT": "-1.15% 收 493.95，5 日 -2.63% 是自選中最弱的美股，但仍在 52 週區間 88% 的高位。分析師認為評價已合理、缺乏新催化劑，這種「不差但沒故事」的股票在利率上升期最容易被減碼；跌破月線（約 495）就是事實。"
  },
  "picks": [
    {
      "symbol": "2344", "market": "tw", "name": "華邦電", "type": "強勢股",
      "reason": "外資單日買超 9.26 萬張居全市場之冠，成交 419 億僅次於台積電，與南亞科（外資買超 3.43 萬張、成交 407 億）同為記憶體族群，是昨日大盤下跌中資金最集中的方向。",
      "watch_for": "今日能否維持 300 億以上量能且外資續買；記憶體報價題材容易急漲急跌，若開高走低留長上影線就是短線籌碼鬆動訊號。"
    },
    {
      "symbol": "3231", "market": "tw", "name": "緯創", "type": "轉弱警示",
      "reason": "宣布 15 億美元 GDR 海外增資後外資賣超 4.61 萬張，帶動電腦週邊類股 -4.13% 成為最弱類股；增資稀釋加上 AI 代工毛利疑慮，是今日電子代工族群的風向標。",
      "watch_for": "是否止跌、廣達與緯穎是否跟跌；若緯創止跌而廣達回穩，代表昨日只是個股事件而非族群轉弱。"
    },
    {
      "symbol": "7769", "market": "tw", "name": "鴻勁", "type": "強勢股",
      "reason": "+6.17% 且成交 131 億擠進漲幅前五，AI 晶片測試介面需求延續，是高價 AI 測試股中量價齊揚的一檔；同族群穎崴亦漲停（成交 61 億）。",
      "watch_for": "高價股單日振幅大，追高要看量能是否延續；若今日量縮回落，代表昨日是短線資金衝刺而非趨勢。"
    },
    {
      "symbol": "INTC", "market": "us", "name": "英特爾", "type": "事件驅動",
      "reason": "+9.05% 為掃描 50 檔大型股中最強，Citi 上調晶片產業展望，資金從 NVDA 往落後的 AI 晶片與設備股輪動（AMD +5.9%、LRCX / AMAT +4%），費半因此逆勢創高。",
      "watch_for": "費半 12,000 整數關卡的攻防；若英特爾隔日無法守住漲幅一半，輪動可能只是一日行情。"
    },
    {
      "symbol": "XLE", "market": "us", "name": "能源類股 ETF", "type": "防禦",
      "reason": "油價逼近 100 美元，能源 +1.11% 是昨日美股最強類股，同時公用事業 +0.86% — 在利率與油價雙升環境下，這兩個類股提供對沖科技股修正的功能。",
      "watch_for": "中東局勢與美國原油庫存數據；油價若快速回落，能源股會第一個反轉。"
    }
  ],
  "events": [
    {"time": "今日盤中", "title": "台股觀察 47,326 收復與否、電腦週邊類股止跌與否", "note": "週一前收盤位置；緯創、廣達、緯穎是指標"},
    {"time": "本週", "title": "台積電 8 月營收（通常 10 日前後公布）", "note": "7 月已創高，市場預期續強"},
    {"time": "9/10（美東）", "title": "NVIDIA 相關重大事件", "note": "多家媒體點名投資人關注，具體內容以公司公告為準"},
    {"time": "本週", "title": "蘋果秋季發表會（可折疊 iPhone）", "note": "影響鴻海、台積電等供應鏈情緒"},
    {"time": "本週晚間", "title": "美國通膨相關數據（本週三項重要經濟報告）", "note": "油價上漲後市場對通膨數據敏感度提高"},
    {"time": "週五", "title": "台灣央行升息半碼與否的關鍵數據", "note": "依經濟日報報導，週五數據是央行判斷依據"},
    {"time": "下週", "title": "Fed 九月 FOMC（與 9/18 四巫日同週）", "note": "目前市場對「不動 vs 升息」分歧擴大"}
  ],
  "risks": [
    "油價若站上 100 美元且美債 10 年殖利率突破 4.9%，高本益比的 AI 與台股（大盤本益比逾 40 倍）將面臨評價壓縮，昨日道瓊 -628 點只是第一波反應。",
    "台股廣度惡化：週一 705 家下跌 vs 282 家上漲，且指數位於 52 週區間 96%、RSI 68.8，若台積電今日無法延續 ADR 漲勢，指數可能出現「權王撐不住」的補跌。",
    "AI 代工族群籌碼鬆動：緯創 GDR 增資引發外資調節（賣超 4.6 萬張），若擴散至廣達、緯穎、鴻海，電子代工的修正會拖累指數。",
    "美加貿易戰升溫與中東能源設施遇襲屬地緣事件，方向難預測；期貨盤前持平不代表安全，今晚美股若再跌會直接反映在明日台股開盤。"
  ]
}
