{
  "key": "2026-10-29-pm",
  "session": "pm",
  "headline": "外資翻空狂賣 688 億、聯電跌停，台股跌 667 點季線一日失守",
  "summary": [
    "加權指數開在全日最高 47,015 點後一路走低，收 46,368 點、跌 1.42%，又跌回季線（46,506）之下。下跌 737 家、上漲只有 232 家，昨天的「破底翻」只撐了一天。",
    "籌碼急轉：外資從昨天買超約 159.6 億元變成賣超 688.15 億元，自營商避險盤也賣 213.16 億元，三大法人合計賣超 832.71 億元。投信只買 70.44 億元，撐不住盤面。外資賣超集中在聯電（約 12.9 萬張）、面板雙虎與 0050，買進的則是金融股。",
    "美股盤中 Alphabet 重挫 12.02%、創 52 週新低，Marvell 跌 12.60%，Nasdaq 跌 1.29%，微軟盤後 4% 的漲幅也全數吐回。AI 資本支出疑慮重新浮現，資金轉往醫療與金融。"
  ],
  "sentiment": {"us": "中性", "tw": "中性偏空"},
  "sections": [
    {
      "title": "台股收盤：季線得而復失，昨天調升太快",
      "body_md": "今天開在 **47,015**，幾乎就是全日最高，之後一路被賣到最低 **46,055**，收 **46,368**，昨天 939 點的長紅被吃掉約七成。\n\n- **技術面**：收盤比季線低 0.30%、比月線低 3.09%，RSI 回落到 26.9。10/27 盤中低點 45,676 是下一道支撐，跌破的話，這段「破底翻」就是假突破。\n- **廣度差**：漲跌家數 232：737，跌勢從權值股擴散到中小型股。\n- **價跌量增**：成交約 7,566 億元，比昨天約 7,011 億元多了近 8%。今天賣方的積極程度，明顯超過昨天的買方。\n\n**認錯**：昨天午報看到法人聯手回補，就把台股調升為中性偏多。結果外資只買一天就轉為大賣，季線也守不到一天，那次調升太早。今天改回**中性偏空**，要先站回季線 46,506 才能談止跌。"
    },
    {
      "title": "類股與個股：聯電、蘋果鏈重挫，金融生技抗跌",
      "body_md": "- **聯電跌停**收 115.5 元，成交約 409.6 億元，僅次於台積電。外資賣約 12.9 萬張，約占當日成交量的三成七，投信也賣約 4.5 萬張。外電指出，聯電昨天公布的第三季 EPS 1.32 元略低於預期，第四季毛利率持平在約 34%，出貨只有低個位數成長，市場解讀為成長動能有限。\n- **光電 -5.18%**：玉晶光跌停收 1,200 元，**大立光 -8.21%** 收 5,815 元（成交約 144.3 億元，開最高、收最低），台郡 -7.79%；外資同時賣友達約 5.0 萬張、群創約 4.6 萬張。不過蘋果本身今晚盤中上漲 1.81%、創 52 週新高，光學股重挫的原因目前查不到可靠來源。\n- **IC 設計分化**：聯發科 -4.49%、盤中低點剛好 4,000 元，台達電 -4.52%。同樣做 ASIC 的**智原卻漲停**，資金只挑財報優於預期的個股。\n- **記憶體降溫**：南亞科平盤收 477 元，盤中在 468～497.5 元之間震盪，成交約 298.8 億元，高檔換手；外資則續買華邦電。\n- **抗跌**：金融保險 +1.05%、生技醫療 +1.10%，資金躲進防禦類股。"
    },
    {
      "title": "資金流向：外資翻空 688 億，只剩投信撐盤",
      "body_md": "（稍早版本發布時法人資料尚未公布，這一版已補上。）\n\n- **三大法人合計賣超 832.71 億元**：外資 -688.15 億、自營商 -215.00 億（幾乎都是避險盤的 -213.16 億）、投信 +70.44 億。新聞指出投信已經連續 13 天買超，但今天的買盤規模只有外資賣盤的一成。\n- **外資賣超集中在電子與 ETF**：聯電、主動中信台灣收益（00406A，約 7.8 萬張）、友達、群創、0050（約 4.3 萬張）。昨天外資才大買面板雙虎，今天就反手賣出，屬於短線進出。\n- **外資買超轉向金融**：台新新光金約 2.0 萬張、中信金約 1.7 萬張、彰銀約 1.0 萬張，加上華邦電約 1.4 萬張，以及不動產 ETF 00712。這和金融類股逆勢上漲的方向一致。\n- **台積電意外持平**：外資只賣 10 張、投信買 443 張，連續減碼的力道暫時停下，台積電今天是穩住指數的力量，不是殺盤主因。\n- **匯率**：新台幣貶到 32.54，已經在 52 週區間 94.9% 的位置，離 52 週高點 32.60 只差一點，和外資大賣的方向一致。\n- **ADR 溢價縮小到 16.85%**：ADR 盤中下跌 1.34%，換算價約 2,822 元。溢價收斂是因為 ADR 下跌，不是因為現股轉強。"
    },
    {
      "title": "美股盤中觀察：好財報也不買單，資金從科技轉往防禦",
      "body_md": "資料擷取時，美股開盤約一小時，以下都是**盤中數字**：S&P 500 -0.31%、Nasdaq -1.29%、費半 -1.60%，但道瓊只跌 0.25%、羅素 2000 反而上漲 0.92%。\n\n- **Alphabet -12.02%**，創 52 週新低，量比已經達到 1.94 倍，RSI 只剩 15.9；ASIC 同業 **Marvell -12.60%**、ARM -3.42%。外電形容「AI 疑慮再起」，明天聯發科、世芯、創意等 ASIC 族群會再受一次考驗。\n- **微軟盤後漲 4%，開盤後全數吐回**，目前 -0.96%。財報優於預期仍守不住漲幅，代表市場現在更在意資本支出的回報，而不只是營收成長。\n- **輪動明顯**：醫療 XLV +2.14%（禮來 +7.15%）、金融 XLF +1.66%（萬事達 +4.59%、Visa +2.64%），兩者都在 52 週高點附近；通訊 XLC -1.71%，收在 52 週低點。台股今天金融強、電子弱，和美股的方向相同。\n- **利率**：10 年債殖利率回落到 4.98%，外電稱今晚的通膨數據大致符合預期。但市場仍預估 Fed 12 月升息的機率超過八成，利率並沒有轉鬆。\n- **今晚收盤後**：亞馬遜財報（台北 10/30 清晨）。AWS 的成長與資本支出，會決定明天台股伺服器、PCB 族群的方向。"
    }
  ],
  "watchlist_notes": {
    "2330": "收 2,415 元、-0.41%，盤中低點 2,390 元，跌幅遠小於大盤；外資只賣 10 張、投信買 443 張，賣壓暫時停下。但股價仍低於季線 2,431.83 元與月線 2,471 元，RSI 19.6 深度超賣，先看能否站回 2,432 元。",
    "2317": "收 248 元、-1.39%，仍守在月線 247.32 元之上、低於季線 250.89 元；外資逆勢買約 3,342 張、投信買約 512 張，是自選股中籌碼最穩的一檔。科技日前，247 元是短線支撐。",
    "2454": "跌 4.49% 收 4,045 元，盤中最低剛好 4,000 元，一個月跌 23.46%、RSI 23.8，外資賣約 1,682 張。今晚 Alphabet、Marvell 雙雙重挫，法說前 4,000 元能否守住是關鍵。",
    "0050": "收 107.25 元、-1.29%，跌回季線 108.13 元之下、RSI 22.7；外資大賣約 4.3 萬張、名列外資賣超第五，投信買約 3,300 張，ETF 層級的外資資金正在流出。",
    "NVDA": "盤中 213.62 美元、-0.81%，低於月線 222.92 與季線 221.91 美元、RSI 34.6；在 Alphabet 重挫的盤面裡跌幅相對有限，但一個月跌 6.46%，仍未擺脫弱勢。",
    "TSM": "盤中 433.62 美元、-1.34%，低於月線 1.68%，換算溢價縮小到 16.85%；溢價收斂是因為 ADR 下跌，對明天台積電開盤的支撐也跟著減少。",
    "AAPL": "盤中 350.07 美元、+1.81%，創 52 週新高、RSI 67.5，和台灣光學供應鏈的重挫呈現明顯背離；11/2 美股盤後財報前，高檔追價風險升高。",
    "MSFT": "盤中 525.90 美元、-0.96%，盤後的漲幅全數吐回，又跌回月線 530.55 美元之下；好財報卻守不住漲幅，顯示市場對 AI 資本支出的耐心正在下降。"
  },
  "picks": [
    {
      "symbol": "2303",
      "market": "tw",
      "name": "聯電",
      "type": "轉弱警示",
      "reason": "跌停收 115.5 元、成交約 409.6 億元。外資賣約 12.9 萬張、投信賣約 4.5 萬張，法人合計賣約 18.3 萬張，是全市場最大的賣壓。法說後市場解讀第四季成長有限。",
      "watch_for": "明天開盤是否還有大量賣單排隊，以及 115.5 元能否守住；外資如果連續賣超，代表在調整對成熟製程的評價，不是一天的事件。"
    },
    {
      "symbol": "3035",
      "market": "tw",
      "name": "智原",
      "type": "強勢股",
      "reason": "大盤跌 667 點時逆勢漲停收 231.5 元，成交約 81.8 億元，盤前新聞點名季報優於預期；同一天聯發科、聯電重挫，它是少數有資金認養的半導體股。",
      "watch_for": "今晚 Marvell、Alphabet 重挫，ASIC 族群的情緒受壓，明天要看它能否守住 231.5 元；若開高走低，代表只是一天的題材行情。"
    },
    {
      "symbol": "2344",
      "market": "tw",
      "name": "華邦電",
      "type": "轉強觀察",
      "reason": "外資昨天買約 2.53 萬張，今天在大賣 688 億的盤面中仍續買約 1.4 萬張，是外資買超前五名中唯一的電子股；南亞科則是平盤高檔換手。",
      "watch_for": "外資能否連續第三天買超，以及南亞科 468 元盤中低點能否守住；若記憶體龍頭轉弱，華邦電也很難獨強。"
    },
    {
      "symbol": "2891",
      "market": "tw",
      "name": "中信金",
      "type": "防禦",
      "reason": "外資買約 1.7 萬張，台新新光金、彰銀也同步被買，金融保險類指數逆勢上漲 1.05%；美股金融 XLF 盤中同樣上漲 1.66%，台美的資金輪動方向一致。",
      "watch_for": "外資買金融是短線避險還是持續布局，要看明天是否續買；若電子股止跌，資金可能很快流回，金融股的強勢也會跟著消退。"
    },
    {
      "symbol": "GOOGL",
      "market": "us",
      "name": "Alphabet",
      "type": "轉弱警示",
      "reason": "財報後盤中重挫 12.02%、創 52 週新低，量比 1.94 倍、RSI 15.9。ASIC 同業 Marvell 也跌 12.60%，是今晚 Nasdaq 和台股 ASIC 族群的最大壓力來源。",
      "watch_for": "收盤是收在低點還是出現下影線反彈；若收在最低附近，明天聯發科 4,000 元與 ASIC 族群可能再承壓一次。"
    }
  ],
  "events": [
    {"time": "10/30 04:00 前後", "title": "亞馬遜第三季財報", "note": "美東 10/29 盤後公布，法說會台北 05:00；AWS 成長與資本支出是本週最後一個 AI 指標"},
    {"time": "10/30（預計）", "title": "聯發科法說會", "note": "依往例在季底最後一週舉行，日期以公司公告為準；股價一個月跌 23.46%，第四季展望與 ASIC 進度是焦點"},
    {"time": "10/30–31", "title": "鴻海科技日", "note": "AI 伺服器布局更新，股價月線 247 元是支撐"},
    {"time": "11/03 04:30", "title": "蘋果 FY26 Q4 財報", "note": "美東 11/2 盤後公布；台灣光學股已經先跌，財報說法會決定是否延續修正"}
  ],
  "risks": [
    "外資單日賣超 688 億元，新台幣貶到 32.54、逼近 52 週高點 32.60；若台幣突破 32.60，代表外資匯出可能延續，大盤恐測試 10/27 低點 45,676。",
    "Alphabet、Marvell 盤中都重挫超過 12%，若今晚收在低點，聯發科跌破 4,000 元的機率升高，IC 設計與 ASIC 族群明天會再修正一次，聯發科法說的展望也可能更保守。",
    "亞馬遜若出現「資本支出上修、AWS 成長未加速」的組合，微軟的例子已經說明市場不再單純獎勵 AI 投資，台股伺服器、PCB、散熱族群會首當其衝。",
    "投信已經連買 13 天，是目前唯一穩定的買盤；若投信因為年底作帳結束或贖回壓力轉為賣超，在外資翻空的情況下，大盤會失去最後一道支撐。"
  ]
}
