{
  "key": "2026-09-10-pm",
  "session": "pm",
  "headline": "外資反手賣超383億、台達電營收月減重挫，大盤失守47000",
  "summary": [
    "加權指數跌 0.51% 收 46940.49，下跌 744 家對上漲 259 家，但成交金額仍近 7,000 億元，屬高檔換手而非恐慌性殺盤。",
    "外資結束連四買、單日賣超 383.34 億元，三大法人合計賣超 503.12 億元，只有投信小買 17.86 億元。",
    "台達電因 8 月營收月減重挫 6.69% 爆量 346 億元成為殺盤主因；聯發科逆勢漲 2.05% 收 4720 撐住半導體。",
    "美債 10 年期殖利率 4.84% 創 52 週新高、油價逼近百元，今晚 20:30 美國 8 月 PPI 是 Fed 下週決議前的關鍵數據。"
  ],
  "sentiment": {"us": "中性偏空", "tw": "中性偏空"},
  "sections": [
    {
      "title": "台股收盤",
      "body_md": "**跌多漲少但量能沒縮**：下跌 744 家對上漲 259 家，漲停 8 家、跌停 0 家，殺盤集中在高價電子與中小型股，不是全面性恐慌。成交金額仍有 6,961 億元，代表多空都在高檔換手，資金沒有撤離。\n\n**類股**：塑膠（+1.67%）受油價帶動最強，金融（+0.34%）與生技（+0.29%）成避風港；電子零組件（-2.26%）、航運（-1.81%）、電機機械（-1.76%）、光電（-1.57%）最弱。半導體只跌 0.26%，靠聯發科、聯電撐住。\n\n**法人**：外資結束連四買、賣超 383.34 億元，自營商再賣 137.64 億元，合計賣超 503.12 億元；投信逆勢買 17.86 億元是唯一買方。外資個股買賣超明細今日無資料。"
    },
    {
      "title": "強弱勢個股",
      "body_md": "**弱勢焦點是台達電**：8 月營收年增創同期新高，卻因月減打斷連續成長動能，股價重挫 6.69% 收在最低點 1675 元、成交 346 億元爆量、成交筆數逾 15 萬筆，市場把「AI 電源成長放緩」放大解讀，連帶拖累電機機械類股。致茂（-6.64%）、新日興（-8.01%）同屬高價電子的評價修正。\n\n**強勢端在被動元件與 CPO**：禾伸堂漲 5.94% 成交 107.7 億元、國巨漲 1.24%，被動元件族群逆勢翻紅；光聖漲 5.88% 收 1800 元延續 CPO 題材；嘉晶（第三代半導體）漲停。\n\n**權值股分歧**：台積電 8 月營收 5,148 億元史上最強，股價卻只反應 -0.61%，屬利多鈍化；聯發科逆勢漲 2.05% 收 4720、距 52 週高 4760 一步之遙，是指數少數的支撐。"
    },
    {
      "title": "資金流向",
      "body_md": "**美債殖利率是主軸**：美國 10 年期殖利率升到 4.84% 創 52 週新高（RSI 70.4 已超買），導火線是美國財政部公債回購規模不如預期，再加上 WTI 95.8 美元、布蘭特站上百元，市場對 Fed 下週「不降反升」的定價升溫，新聞估升息機率約六成。美元指數 98.75 平穩、新台幣 31.52 小貶，尚未出現明顯匯出。\n\n**避險資產**：黃金 4456.4（+0.91%）在 4400 站穩；VIX 16.31 雖日跌 0.91%，但 5 日升 13.9%，隱含波動仍在墊高。比特幣 78,021 小跌，風險偏好中性。\n\n**台股解讀**：外資賣超與美債殖利率同步走高，代表今日賣壓是資金成本上升引發的評價調整，不是基本面惡化，台積電、台達電營收都創同期新高即是佐證。這種修正通常快而不深，但要等殖利率停止創高才會結束。"
    },
    {
      "title": "美股盤前觀察",
      "body_md": "**昨夜結構**：三大指數三連黑，費半逆勢四連漲（+0.37%、5 日 +5.69%），美光、超微、Marvell 領漲，記憶體與 AI 晶片仍是資金唯一集中處。羅素 2000 跌 1.32%，工業（XLI，RSI 24.7）與不動產（XLRE）接近超賣，利率敏感族群最受傷。Meta 漲 6.55%、RSI 89.6、量比 2.07 是單一極端；蘋果發表 iPhone 18 Pro 後小跌並放量，典型利多出盡。\n\n**今晚看什麼**：S&P 500 期貨亞洲盤小漲 0.26%（Nasdaq 期貨今日無資料）。20:30 美國 8 月 PPI 是 Fed 會前關鍵，若批發通膨高於預期，殖利率再創高會壓抑成長股；反之費半有機會延續。明晚 CPI 接力。台積電 ADR 溢價 12.02% 偏高，若 ADR 今晚補跌，明早台股開盤承壓。"
    }
  ],
  "watchlist_notes": {
    "2330": "收 2450 跌 0.61%，8 月營收 5,148 億元創新高卻利多不漲，仍站在 20 日線 2410 上方、距 52 週高 2510 約 2.4%，量比 1.1 屬正常換手，觀察今日低點 2435 是否守住。",
    "2317": "收 251 跌 0.40%，貼著 20 日線 250.47 整理、近一月仍跌 7.04%，蘋果新機發表後反應平淡，量比 1.16 沒有明顯資金進場，245–255 區間未突破前偏中性。",
    "2454": "逆勢漲 2.05% 收 4720，距 52 週高 4760 僅一步，但 RSI 77.8、高出 20 日線 13.93% 已明顯過熱，量比 0.86 顯示追價力道趨緩，創高後若出現長上影線要留意獲利了結。",
    "0050": "收 109.15 跌 0.46%，仍高於 20 日線 2.61%、52 週位置 94.8%，量比 0.69 明顯縮量，代表大盤拉回是被動縮手而非主動殺出，守住 20 日線 106.37 前結構未變。",
    "NVDA": "收 223.67 跌 0.91%，量比 0.64 縮量整理、仍在 20 日線 220.8 上方，董事申報出脫 6.4 億美元持股屬短線雜訊，觀察 220 支撐。",
    "TSM": "收 435.36 跌 0.83%，RSI 65.6 仍偏強、5 日漲 5.16%，ADR 溢價 12.02% 偏高，代表海外資金對台積電比台北盤樂觀，但 ADR 追價空間也被壓縮。",
    "AAPL": "iPhone 18 Pro 與 iPhone Duo 發表後跌 0.28%、量比 1.61 放量，典型利多出盡，價格貼著 20 日線 314.06，若跌破可能引動台股蘋概股再修正。",
    "MSFT": "收 491.65 跌 0.47%，跌破 20 日線但仍高出 60 日線 12.57%，量比 0.59 極度縮量屬多頭休息，觀察 490 整數關卡。"
  },
  "picks": [
    {
      "symbol": "2308",
      "market": "tw",
      "name": "台達電",
      "type": "轉弱警示",
      "reason": "8 月營收月減打斷成長動能，股價重挫 6.69% 收最低 1675 元、成交 346 億元爆量，是今日大盤失守 47000 的主因，也代表市場開始對 AI 電源族群的成長斜率挑剔。",
      "watch_for": "明日能否守住 1675 今日低點並縮量；若續破且光寶科等同族群跟跌，代表高價 AI 股評價修正擴散。"
    },
    {
      "symbol": "3026",
      "market": "tw",
      "name": "禾伸堂",
      "type": "強勢股",
      "reason": "被動元件族群在大盤跌多漲少時逆勢翻紅，禾伸堂漲 5.94% 成交 107.7 億元、國巨同步漲 1.24%，資金從 AI 電源轉進被動元件的輪動跡象明顯。",
      "watch_for": "今日高點 826 是否能帶量站穩；若隔日量縮跌回 763 開盤價以下，視為一日行情。"
    },
    {
      "symbol": "MU",
      "market": "us",
      "name": "美光",
      "type": "強勢股",
      "reason": "漲 2.75% 收 1027.77 重返千元，與 SK 海力士創新高呼應，記憶體是美股三連黑中資金唯一持續流入的族群，近一月漲 19.37%。",
      "watch_for": "站穩 1000 整數關與 20 日線 958；台股記憶體股近日遭外資調節，若美光續強台股記憶體有補漲機會。"
    },
    {
      "symbol": "META",
      "market": "us",
      "name": "Meta",
      "type": "強勢股",
      "reason": "單日漲 6.55%、量比 2.07、5 日漲 12.99%，是大型股中最強的動能，但 RSI 89.6 已進入極端超買區。",
      "watch_for": "今晚若高開低走並吞噬昨日漲幅，代表追價資金衰竭；追高風險大於錯過風險。"
    },
    {
      "symbol": "XOM",
      "market": "us",
      "name": "埃克森美孚",
      "type": "事件驅動",
      "reason": "布蘭特站上百元、WTI 95.8 美元近一月漲 15.14%，能源類股 ETF（XLE）創 52 週新高，埃克森漲 2.22% 是三連黑中的防禦性選擇。",
      "watch_for": "油價若因地緣消息回落至 90 美元以下，能源股將率先回吐；同時留意油價續漲對台股塑膠（今日 +1.67%）的連動。"
    }
  ],
  "events": [
    {"time": "今晚 20:30", "title": "美國 8 月 PPI（生產者物價指數）", "note": "Fed 下週決議前倒數第二項通膨數據，同時公布初領失業金人數；若高於預期，美債殖利率恐再創高"},
    {"time": "明日 20:30", "title": "美國 8 月 CPI", "note": "Fed 會前最後一項關鍵通膨數據"},
    {"time": "9/16（三）", "title": "台指期 9 月合約結算", "note": "結算前權值股波動放大，留意外資期貨部位"},
    {"time": "9/17 02:00", "title": "Fed 利率決議（FOMC 9/15–16）", "note": "新聞估市場定價升息機率約六成，點陣圖與記者會措辭是重點"},
    {"time": "9/18（五）", "title": "美股四巫日", "note": "季度選擇權與期貨同步到期，成交量與波動放大"}
  ],
  "risks": [
    "若今晚 PPI 高於預期，美債 10 年期殖利率從 4.84% 續創新高，Fed 升息機率升破六成，台股高本益比 AI 股（聯發科 RSI 77.8、高出月線近 14%）評價壓力最大。",
    "外資單日賣超 383.34 億元若連續兩日以上，且新台幣從 31.52 持續走貶，代表資金實質匯出，加權指數可能回測月線。",
    "WTI 95.8 美元、布蘭特破百，油價續漲會推升通膨預期並壓縮多數類股毛利；航運、電機機械已率先轉弱。",
    "台達電營收月減引發的賣壓若擴散到 AI 電源、散熱與高價電子，跌停 0 家的秩序性修正可能轉為非理性殺盤。"
  ]
}
