{
  "key": "2026-10-07-pm",
  "session": "pm",
  "headline": "台股平盤守高檔：電子股休息，塑化、被動元件接棒撐盤",
  "summary": [
    "加權指數小跌 0.03% 收 49,806 點，盤中一度跌約 255 點到 49,567 點後收復；成交金額降到約 8,660 億元、連兩天量縮，但上漲 588 家多於下跌 387 家，跟昨天「指數漲、多數個股跌」正好相反，資金在輪動，沒有退場",
    "類股強弱很分明：塑膠 +6.85%（台塑漲停、南亞 +7.17%）、建材、電機、金融都漲超過 1%；電子零組件 -1.39%、電腦週邊 -1.28%，川湖因 9 月營收結束連續 6 個月創高，開盤就鎖跌停，穎崴也跌停，高價電子股被調節",
    "美股昨晚收盤確認 S&P 500、Nasdaq 改寫新高，Marvell 漲 5.81%、量能 2.72 倍；台積電 ADR 跌 0.72%、溢價降到 18.85%。今晚期貨持平，重點是台北時間 10/8 凌晨 02:00 的 Fed 會議紀要，台股只剩 10/8 一天可以反應，接著就連休三天"
  ],
  "sentiment": {
    "us": "中性偏多",
    "tw": "中性"
  },
  "sections": [
    {
      "title": "台股收盤：指數原地踏步，底下在換手",
      "body_md": "台積電 ADR 昨晚下跌，台積電開低到 2,565 元，加上川湖跳空跌停，加權指數盤中最低到 **49,567 點**；後來台積電收復平盤，傳產接手，終場收 **49,806 點**，只差 16 點就平盤。\n\n今天的結構跟昨天正好相反：\n- **廣度轉好**：上漲 588 家（漲停 12 家）、下跌 387 家，資金沒有離場，只是從電子股換到傳產\n- **量續縮**：成交金額約 8,660 億元，比昨天約 9,619 億元再少約一成，連假前追價意願不高\n- **仍然過熱**：RSI 89.9，距月線約 47,577 點乖離 4.68%\n\n5 萬點前連兩天攻不上去，但也沒有破壞走勢。這種「指數不動、類股輪動」的盤，通常是高檔整理，不是轉弱；真正要看的是電子權值股會不會從休息變成修正。"
    },
    {
      "title": "類股輪動：塑化、被動元件吸金，高價電子股跌停",
      "body_md": "**強勢：傳產與「漲價題材」**\n- **塑化股集體走強**：台塑漲停鎖 75.4 元、成交約 84 億元；南亞盤中最高 322 元，收 +7.17%，成交約 370 億元，**跟台積電差不多**。南亞同時有 CCL／玻纖布（AI 伺服器材料）的題材，資金動能比單純的景氣循環反彈更強\n- **被動元件**：國巨成交約 591 億元，**超過台積電成為成交金額第一**，華新科漲停、成交約 220 億元。不過國巨盤中一度上衝 686 元（接近漲停）後收 647 元，**漲幅吐掉約 2/3，留下長上影線**，追價資金在高檔遇到賣壓\n- 光聖漲停收 1,815 元，光通訊族群仍有短線資金\n\n**弱勢：高價電子股**\n- **川湖跌停鎖 11,790 元**，全天只成交 198 筆，代表賣單掛著沒成交；導火線是 9 月營收結束連續 6 個月創高，市場對萬元股的營收成長很敏感\n- **穎崴開 5,785 元、最高 6,010 元後一路賣到跌停** 5,520 元，成交約 93 億元，高價測試介面股遭調節\n- 聯發科、達發同步走弱，IC 設計族群連兩天被賣"
    },
    {
      "title": "籌碼與匯率：法人資料還沒出，台幣先貶",
      "body_md": "**三大法人買賣超今日無資料**（本資料擷取時間早於證交所盤後公布），外資是否連兩天賣超要等盤後確認。昨天法人合計賣超 192 億元、投信是最大賣方；今天如果再出現法人一起賣、只靠內資與散戶撐傳產，連假前的籌碼就偏弱。\n\n匯率先給了一點訊號：\n- **新台幣貶 0.32% 到 31.85 元**，美元指數 102.10 逼近 52 週高點 102.17\n- 美債 10 年殖利率 5.27%，仍在 52 週區間 95% 的高位\n\n美元強、台幣貶通常代表熱錢流入放慢。昨天提醒「法人在 5 萬點前先落袋」，台幣走勢暫時沒有推翻這個看法。若盤後外資轉回買超、而且買在台積電與電子權值股，才算是連假前的正面訊號。"
    },
    {
      "title": "今晚美股觀察：新高之後，等 Fed 會議紀要",
      "body_md": "**昨晚收盤確認**：S&P 500 +0.58%、Nasdaq +0.45% 都改寫收盤新高；費半 +0.34%，羅素 2000 -0.59%，漲勢仍集中在大型科技股。\n\n- **AI 晶片設計股收盤續強**：Marvell +5.81%、量能 2.72 倍，博通 +3.67%、超微 +2.80% 再創 52 週新高。昨天點名的 Marvell 盤中強勢，收盤也守住了\n- **半導體設備股收盤跌更深**：KLA -4.54%、科林研發 -3.44%、應用材料 -2.21%，比盤中跌幅擴大，設備股獲利了結還沒結束\n- 公用事業 +2.98% 領漲類股，資金同時往防禦股布局\n\n**今晚**：S&P 500 期貨 +0.01%、Nasdaq 期貨 -0.05%，幾乎持平，市場在等 **台北時間 10/8 凌晨 02:00 的 Fed 9 月會議紀要**。9 月會議有附點陣圖，紀要會揭露委員對 2026–2027 年利率路徑的分歧。10 年債 5.27% 離 52 週高點 5.31% 只差一點，偏鷹的內容很容易讓殖利率創高，RSI 超過 80 的輝達、費半首當其衝。"
    }
  ],
  "watchlist_notes": {
    "2330": "平盤收 2,585 元，ADR 下跌讓它開低到 2,565 元，最後收在最高點，量能只有均量的 0.79 倍，賣壓不大；ADR 溢價仍有 18.85%，2,560 元（今日低點）是短線參考，Fed 會議紀要後的 ADR 表現決定 10/8 開盤方向。",
    "2317": "跌 1.56% 收 252 元，跌破昨天提醒的 253.5 元，盤中最低 251.5 元試月線約 251 元，量能 1.1 倍；營收破兆的利多已經被消化，250 元整數關卡是連假前最後防線。",
    "2454": "跌 1.73% 收 4,835 元、收在最低點，剛好落在月線約 4,835 元；Token 額度爭議延燒，連兩天走弱。昨天提醒的月線已經到了，10/8 收盤若跌破，短線修正就會拉長。",
    "0050": "跌 0.39% 收 116.05 元，量能 0.86 倍；今天是傳產與中小型股撐盤，台積電平盤，0050 吃不到輪動行情。RSI 85.3 仍偏熱，走勢繼續跟著台積電與 Fed 會議紀要。",
    "NVDA": "收盤小漲 0.14% 到 239.24 美元，創 52 週收盤新高，但盤中漲幅幾乎吐光；SpaceX 傳出要募資 400 億美元買輝達晶片，需求面仍有支撐。RSI 84 偏熱，Fed 會議紀要前追價風險高。",
    "TSM": "收盤跌 0.72% 到 482.3 美元，跌幅比盤中擴大，換算溢價降到 18.85%，昨天提醒的溢價收斂持續進行；RSI 88 仍極度過熱，若設備股繼續回檔，ADR 也會受壓。",
    "AAPL": "小漲 0.22% 收 333.63 美元，貼著月線約 333 美元、RSI 51.5，走勢中性；報導指出庫克本月出售約 6,390 萬美元持股，短線缺乏推升力道，股價持續在月線附近整理。",
    "MSFT": "漲 0.78% 收 529.30 美元，再創 52 週新高，年初至今漲 33.2%，是四檔美股自選中最強；RSI 76.3 偏熱但沒有到極端，利率若在會議紀要後走高，高本益比股會先受到考驗。"
  },
  "picks": [
    {
      "symbol": "1303",
      "market": "tw",
      "name": "南亞",
      "type": "強勢股",
      "reason": "連兩天領漲塑化股，今天收 +7.17%，成交約 370 億元，跟台積電差不多；除了塑化回溫，還有 CCL／玻纖布 AI 材料題材，台塑也同步漲停，族群性很明確。",
      "watch_for": "盤中最高 322 元但沒有漲停，10/8 能否守住今日開盤 293 元以上；若連假前開高走低、量能縮不下來，代表是短線資金一日行情。"
    },
    {
      "symbol": "2327",
      "market": "tw",
      "name": "國巨",
      "type": "事件驅動",
      "reason": "成交約 591 億元，超過台積電成為全市場成交第一，華新科同步漲停，MLCC 漲價題材吸引大量資金；但盤中衝到 686 元後收 647 元，漲幅吐掉約 2/3。",
      "watch_for": "長上影線代表高檔賣壓很重，10/8 能否站回 660 元以上；若跌破今日開盤 630 元，代表追價資金被套，族群熱度可能降溫。"
    },
    {
      "symbol": "2059",
      "market": "tw",
      "name": "川湖",
      "type": "轉弱警示",
      "reason": "9 月營收結束連續 6 個月創高，開盤就鎖跌停 11,790 元，全天只成交 198 筆，賣單掛著沒成交；同日穎崴也跌停，萬元、五千元級的高價股對營收放緩反應很劇烈。",
      "watch_for": "10/8 會不會再鎖跌停；若跌停打開、大量換手，賣壓有機會一次出清，若繼續鎖死，代表連假前還有賣壓沒出完。"
    },
    {
      "symbol": "6442",
      "market": "tw",
      "name": "光聖",
      "type": "強勢股",
      "reason": "電子股普遍走弱下仍亮燈漲停收 1,815 元，成交約 65 億元，開盤 1,715 元後直接攻上漲停，光通訊題材仍是電子股裡少數有資金追的支線。",
      "watch_for": "10/8 能否守住 1,715 元（今日開盤價與最低點）；高價股剛出現川湖、穎崴跌停的例子，若開高走低要提防同樣被調節。"
    },
    {
      "symbol": "MRVL",
      "market": "us",
      "name": "Marvell",
      "type": "強勢股",
      "reason": "昨天點名後，收盤漲 5.81% 到 287.01 美元、量能 2.72 倍，盤中強勢延續到收盤；近一個月漲 28.39%，與博通、超微一起帶動 ASIC／客製化晶片族群。",
      "watch_for": "RSI 83.2 偏熱，距 52 週高點 310.58 美元約 8%；Fed 會議紀要若偏鷹，漲最多的 AI 晶片股最容易先回檔。"
    }
  ],
  "events": [
    {
      "time": "10/7 盤後",
      "title": "台股三大法人買賣超",
      "note": "今日資料未出；若外資、投信連兩天賣超，5 萬點前整理會拉長"
    },
    {
      "time": "10/8 02:00",
      "title": "Fed 9 月會議紀要",
      "note": "本週最重要事件；9 月會議有點陣圖，留意委員對 2026–2027 年降息與通膨的分歧，10 年債 5.27% 離 52 週高點只差一點"
    },
    {
      "time": "10/8",
      "title": "台股連假前最後交易日",
      "note": "10/9–10/11 休市三天，台股只有一天消化會議紀要，留意連假前減碼賣壓"
    },
    {
      "time": "10/8 20:30",
      "title": "美國初領失業救濟金",
      "note": "台股已收盤，影響會在 10/12 開盤一起反映"
    },
    {
      "time": "10/9 22:00",
      "title": "美國密大消費者信心初值",
      "note": "台股休市期間公布，留意通膨預期分項"
    },
    {
      "time": "10/10 前",
      "title": "上市櫃 9 月營收陸續公布",
      "note": "川湖營收結束創高就跌停、鴻海營收破兆反而被賣，市場對營收的要求很高，連假前公布的公司股價波動會放大"
    }
  ],
  "risks": [
    "Fed 會議紀要風險只有一天可以消化：若紀要偏鷹，10 年債突破 5.31% 的 52 週高點，RSI 超過 80 的輝達、費半與台積電 ADR 容易回檔，台股在 10/8 反應後就連休三天，連假期間的美股波動要到 10/12 才能反映。",
    "高價電子股鬆動擴散：川湖、穎崴跌停，聯發科剛好壓在月線約 4,835 元、鴻海逼近 250 元。若 10/8 兩者同時跌破，指數只剩台積電撐，回測月線約 47,577 點（約 -4.5%）的機率提高。",
    "輪動行情的持續性：國巨漲幅吐掉約 2/3、南亞未能漲停，傳產與被動元件是否只是一日行情要再觀察；若明天傳產回吐、電子又沒接手，量縮整理可能變成量縮下跌。",
    "美元走強：美元指數 102.10 逼近 52 週高點 102.17，新台幣貶到 31.85 元。若美元突破前高、台幣往 32 元走貶，外資在台積電 ADR 溢價約 18.85% 的情況下，賣超壓力可能加大。"
  ]
}
