{
  "key": "2026-10-30-pm",
  "session": "pm",
  "headline": "台股重挫 1,157 點跌破前低，那指期再跌 2% 今晚恐續壓",
  "summary": [
    "加權指數開在全日最高 46,140 點，盤中最低 44,726 點，收 45,211 點、跌 2.49%，跌破 10/27 低點 45,676。下跌 941 家、上漲只有 92 家，跌停 11 家，10/28 的「破底翻」正式確認失敗。",
    "賣壓集中在 AI 硬體裡籌碼最擁擠的族群：電子零組件 -6.46%、光電 -6.34%，台達電跌停，國巨 -7.55%、華新科跌停，友達也跌停。全盤只有航運類股逆勢上漲 1.93%。",
    "亞馬遜、英特爾財報後在盤後重挫，Nasdaq 期貨亞洲盤再跌 2.02%。新台幣貶到 32.65、創 52 週新低。三大法人資料截稿時尚未公布。"
  ],
  "sentiment": {"us": "中性偏空", "tw": "偏空"},
  "sections": [
    {
      "title": "台股收盤：跌破 10/27 低點，反彈確認失敗",
      "body_md": "昨天午報寫過：「10/27 盤中低點 45,676 是下一道支撐，跌破的話，這段破底翻就是假突破。」今天開盤就跳空，盤中一度跌超過 1,600 點，收盤仍跌 1,157 點，**支撐直接失守**。\n\n- **技術面**：指數比月線低 5.27%、比季線低 2.86%，RSI 23.4，已經是深度超賣。新聞指出大盤與台積電同時跌破半年線。今天盤中低點 **44,726** 是新的短線支撐。\n- **量能**：成交約 7,587 億元，和昨天約 7,566 億元差不多。價跌量平，代表賣壓沒有放大，但也沒有看到承接的量。\n- **月線收黑**：10/31 是週六，今天就是 10 月最後一個交易日。本月指數跌 5.86%、本週跌 3.57%，月底作帳行情完全沒有出現。\n\n**今天改為偏空**：要先收復 45,676 點，才能把今天的跌勢看成超賣後的急殺；在那之前，反彈都先視為解套賣壓。"
    },
    {
      "title": "類股與個股：AI 硬體擁擠部位出清，航運獨撐",
      "body_md": "- **電源與被動元件重災**：台達電跌停收 1,335 元，成交約 244.8 億元，是全市場第四大，開盤後最高只到 1,395 元，盤中幾乎沒有反彈。國巨 -7.55%、華新科跌停（成交約 131.6 億元）。電子零組件類指數 -6.46%，是今天跌最重的類股。目前查不到台達電今天的個別利空，比較像是 AI 資本支出疑慮下，漲多又擁擠的部位一起出清。\n- **面板再跌停**：友達跌停收 30.65 元，成交約 2.94 億股；誠美材也跌停，光電類指數 -6.34%。外資昨天才大賣面板雙虎，今天賣壓還沒停。\n- **權值股相對抗跌**：台積電 -1.86%，盤中只在 2,360～2,380 元的 20 元區間內波動，跌幅比大盤小；聯發科 -3.21%，盤中最低 3,805 元，**4,000 元關卡失守**，收在 3,915 元，量比 1.84 倍。\n- **航運逆勢**：長榮 +4.02% 收在最高 271.5 元，萬海 +4.35%、陽明 +2.42%，是資金撤出電子股後少數的去處。"
    },
    {
      "title": "資金流向：法人資料未出，匯率先給答案",
      "body_md": "- **三大法人：今日無資料**。截稿時（14:11）證交所的法人買賣超還沒公布，外資買賣超排行也是空白。新聞統計外資到昨天為止 4 天已賣超逾 2,300 億元，今天跌幅擴大，續賣的機率高，但實際數字要等證交所公布。\n- **新台幣貶到 32.65**，已經在 52 週區間 100% 的位置，也就是一年來最弱。昨天午報提醒「突破 32.60 代表外資匯出延續」，今天已經應驗。\n- **ETF 爆量**：0050 量比 2.05 倍，新聞也提到外資連日賣 0050，顯示外資是從整體部位撤出，不是只挑個股調節。\n- **ADR 溢價擴大到 18.98%**：ADR 昨晚 -1.75%，換算價約 2,820 元。溢價變大主要是新台幣貶值加上現股下跌，不是 ADR 轉強，不宜解讀為下週台積電有補漲空間。"
    },
    {
      "title": "美股盤前觀察：亞馬遜、英特爾財報後，那指期再跌 2%",
      "body_md": "- **期貨**：亞洲盤 Nasdaq 期貨 -2.02%、S&P 500 期貨 -0.92%，跌幅集中在科技股。外電指出，亞馬遜與英特爾財報後都在盤後重挫。昨天 Alphabet 已經跌了 12.64%、創 52 週新低，量比 4.5 倍，今晚等於 AI 資本支出疑慮的第二波。\n- **亞馬遜**：昨天正常盤在財報前就跌 4.25%，量比 2.2 倍，已經有資金先撤。今晚 21:30 開盤若再跌，AWS 供應鏈（伺服器、電源、PCB）週一還要再面對一次賣壓。\n- **輪動未停**：昨晚醫療 XLV +2.40%、創 52 週新高，禮來 +6.63%，金融 XLF +1.44%；通訊 XLC 收在 52 週低點。羅素 2000 還上漲 1.01%，代表不是全面性恐慌，而是資金從大型科技股撤出。VIX 只有 17.2，恐慌程度不高。\n- **利率與美元**：10 年債殖利率回落到 4.99%，美元指數 101.82 小跌，總經面對股市的壓力沒有加大。今晚的壓力主要來自企業財報。"
    }
  ],
  "watchlist_notes": {
    "2330": "收 2,370 元、-1.86%，量比 1.51 倍，盤中只在 2,360～2,380 元之間波動，跌幅比大盤小；但股價已低於季線 2,431.83 元與月線 2,465.5 元，RSI 19.0 深度超賣。下週先看 2,360 元能否守住，再看 2,432 元季線。",
    "2317": "收 245.5 元、-1.01%，跌回月線 247.03 元之下，量比 0.87 倍，賣壓不重。科技日接連發表電動車新車款，股價反應有限；週一要看能否站回 247 元。",
    "2454": "收 3,915 元、-3.21%，盤中最低 3,805 元，**4,000 元關卡失守**；量比 1.84 倍、RSI 24.1，一個月跌 20.26%。比月線低 11.27%、超跌明顯，但亞馬遜、英特爾財報後 AI 情緒再受打擊，止穩訊號要先看能否收復 4,000 元。",
    "0050": "收 104.95 元、跌 2.14%，量比 2.05 倍、RSI 19.8，比月線低 5.32%、比季線低 2.91%；外資連日在 ETF 層級賣出，價跌量增，賣壓還沒出清。",
    "NVDA": "昨收 213.66 美元、-0.80%，比月線低 4.16%、RSI 34.7；Alphabet 重挫當天跌幅相對有限，但新聞提到競爭調查與間諜報告兩項新疑慮，今晚 Nasdaq 期貨 -2% 的環境下，仍難擺脫弱勢。",
    "TSM": "昨收 431.81 美元、-1.75%，跌回月線 440.97 美元之下，量比 0.74 倍；換算溢價擴大到 18.98%，主要來自台幣貶值與現股下跌。今晚若跌破季線 432.95 美元，週一台積電會再受壓。",
    "AAPL": "昨收 348.91 美元、+1.48%，再創 52 週新高、RSI 66.5，是大型科技股中少數的資金避風港；美東 11/2 盤後財報前位置偏高，台灣光學鏈已先跌，財報說法會決定這個背離怎麼收斂。",
    "MSFT": "昨收 530.14 美元、-0.16%，量比 1.86 倍，幾乎貼著月線 530.76 美元；財報後兩天都守不住漲幅，顯示市場對 AI 資本支出回報的耐心有限。"
  },
  "picks": [
    {
      "symbol": "2603",
      "market": "tw",
      "name": "長榮",
      "type": "強勢股",
      "reason": "大盤跌 1,157 點、941 家下跌的盤面中，上漲 4.02% 收在最高 271.5 元，成交約 60.6 億元；萬海、陽明同步上漲，航運是今天唯一上漲的類股。",
      "watch_for": "這是避險資金暫時停留，還是運價題材？週一電子股若止穩，資金可能流回電子股；開高走低、跌破 261 元開盤價，代表只是一日行情。"
    },
    {
      "symbol": "2308",
      "market": "tw",
      "name": "台達電",
      "type": "轉弱警示",
      "reason": "跌停收 1,335 元，成交約 244.8 億元，開盤後最高只有 1,395 元、幾乎沒有反彈。目前查不到個別利空，比較像是 AI 電源這個擁擠部位，在亞馬遜財報前後集體出清。",
      "watch_for": "週一開盤是否還有跌停賣單排隊，以及法人資料公布後外資、投信的賣超規模；若連續兩天跌停，代表調整的是評價，不只是短線賣壓。"
    },
    {
      "symbol": "2492",
      "market": "tw",
      "name": "華新科",
      "type": "轉弱警示",
      "reason": "跌停收 381 元，成交約 131.6 億元，龍頭國巨同步跌 7.55%、成交約 223.1 億元，電子零組件類指數 -6.46% 領跌全市場，被動元件族群全面殺盤。",
      "watch_for": "國巨能否守住今天 493 元的盤中低點；若龍頭續跌，華新科與其他二線被動元件股的跌幅通常更大。"
    },
    {
      "symbol": "2352",
      "market": "tw",
      "name": "佳世達",
      "type": "轉強觀察",
      "reason": "盤中一度跌到 29.55 元，收盤拉回 33.8 元、上漲 3.05%，振幅超過 15%，成交約 24.9 億元、約 7,876 萬股，是今天少數逆勢收紅、成交量又大的電子股。上漲原因目前沒有可靠來源可以確認。",
      "watch_for": "低接買盤是否延續，能否站穩今天 34.5 元的高點；若隔天回到 31 元開盤價附近，就只是盤中急殺後的技術反彈。"
    },
    {
      "symbol": "AMZN",
      "market": "us",
      "name": "亞馬遜",
      "type": "事件驅動",
      "reason": "財報前一天正常盤就跌 4.25%、量比 2.2 倍，財報後盤後再重挫，帶動 Nasdaq 期貨 -2.02%。它是繼 Alphabet 之後，第二家讓市場懷疑 AI 資本支出回報的雲端大廠。",
      "watch_for": "今晚 21:30 開盤的跳空幅度，以及收盤是否收在低點；AWS 成長與資本支出的說法，會直接影響台股伺服器、電源與 PCB 族群週一的表現。"
    }
  ],
  "events": [
    {"time": "16:30 前後", "title": "證交所三大法人買賣超", "note": "截稿時尚未公布；外資前 4 天已賣超逾 2,300 億元，看今天是否擴大"},
    {"time": "21:30", "title": "美股開盤", "note": "亞馬遜、英特爾財報後的第一個交易日，Nasdaq 期貨亞洲盤 -2.02%"},
    {"time": "10/30–31", "title": "鴻海科技日", "note": "電動車新車款陸續發表，股價月線 247 元是觀察點"},
    {"time": "11/01（日）", "title": "美國夏令時間結束", "note": "11/2 起美股開盤改為台北時間 22:30、收盤 05:00"},
    {"time": "11/03 04:30 前後", "title": "蘋果 FY26 Q4 財報", "note": "美東 11/2 盤後公布；股價在 52 週新高，台灣光學鏈已先修正"}
  ],
  "risks": [
    "今晚 Nasdaq 若真的跌 2% 以上、收在低點，週一台股很可能跳空跌破今天盤中低點 44,726，而且超賣反彈會被延後；聯發科 3,805 元、台積電 2,360 元是兩個權值股的短線底線。",
    "新台幣已經貶到 32.65、創 52 週新低，若下週再往 33 元方向貶值，代表外資匯出還沒結束，任何反彈都可能被當成出場機會。",
    "台達電、國巨、華新科同一天跌停或重挫，代表 AI 硬體裡籌碼最擁擠的部位正在出清；若下週開盤仍有大量跌停賣單排隊，融資斷頭可能引發第二波賣壓。",
    "三大法人資料今天缺漏。若晚間公布的外資賣超再超過 600 億元，而且投信連續買超中斷，代表大盤最後一道買盤也鬆動，偏空的看法會更確定。"
  ]
}
